NUMBER,TRAD,SIMPL,PINYIN,SEMANTIC,FORM-CHAR,Old-Chinese,FORM-MECH,TITLE,PoemGroup,LINE,TRANSLATION,ZDIC,RICCI,,,,,
502,憲憲,宪宪,xiàn xiàn,EVALUATION,AA,,REDUPLICATION,板,DaYa,天之方難、無然憲憲。,Heaven is now sending down calamities; Do not be so complacent.,1. 欣喜自得的樣子。詩經．大雅．板：「天之方難，無然憲憲。」 2. 興盛的樣子。禮記．中庸：「詩曰：『嘉樂君子，憲憲令德。』」唐．柳宗元．箕子碑：「憲憲大人，顯晦不渝。」,L’air joyeux; satisfait; content.,,,,,
503,顯顯,显显,xiǎn xiǎn,EVALUATION,AA,,REDUPLICATION,假 樂,DaYa,假樂君子、顯顯令德。,Of [our] admirable, amiable, sovereign, Most illustrious is the excellent virtue.,昭明顯耀的樣子。詩經．大雅．假樂：「假樂君子，顯顯令德。」,,,
504,僊僊,仙仙,xiān xiān,MOVEMENT,AA,,REDUPLICATION,賓 之 初 筵,XiaoYa,舍其坐遷、屢舞僊僊。,They leave their seats, and go elsewhere, They keep dancing and capering.,,,,,
505,囂囂,嚣嚣,xiāo xiāo,EVALUATION,AA,,REDUPLICATION,板 ,DaYa,我即而謀、聽我囂囂。,I come to advise with you, And you hear me with contemptuous indifference.,1. 無欲自得的樣子。孟子．盡心上：「人知之，亦囂囂；人不知，亦囂囂。」2. 言語紛紜的樣子。詩經．小雅．十月之交：「無罪無辜，讒口囂囂。」,,,,,
506,蕭蕭,萧萧,xiāo xiāo,SOUND,AA,,REDUPLICATION,車 攻,XiaoYa,蕭蕭馬鳴、悠悠旆旌。,"As if at their ease, the horses neighed, Long and slow moved the line of pennons and banners;",1.狀聲詞：(a)​ 形容馬鳴聲。唐．杜甫．兵車行：「車轔轔，馬蕭蕭，行人弓箭各在腰。」(b)​ 形容風聲。史記．卷八十六．刺客傳．荊軻傳：「風蕭蕭兮易水寒，壯士一去兮不復還。」(c)​形容落葉聲。唐．杜甫．登高詩：「無邊落木蕭蕭下，不盡長江袞袞來。」2. 白髮稀疏的樣子。宋．陸游．南鄉子．早歲入皇州詞：「三十年來真一夢，堪愁。客路蕭蕭兩鬢秋。」金．元好問．石州慢．擊筑行歌詞：「漫漫長路，蕭蕭兩鬢黃塵，騎驢漫與行人語。」,1.Onomat. imitant un sifflement, comme celui du vent. 2. Onomat. imitant le hennissement d’un cheval.,,,,
507,囂囂,嚣嚣,xiāo xiāo,SOUND,AA,,REDUPLICATION,車 攻,XiaoYa,之子于苗、選徒囂囂。,Of the officers in charge of the hunt, The voices resounded as they told off the men.,1. 無欲自得的樣子。孟子．盡心上：「人知之，亦囂囂；人不知，亦囂囂。」2. 言語紛紜的樣子。詩經．小雅．十月之交：「無罪無辜，讒口囂囂。」,,,,,
508,囂囂,嚣嚣,xiāo xiāo,SOUND,AA,,REDUPLICATION,十 月 之 交,XiaoYa,無罪無辜、讒口囂囂。,Without crime or offense of any kind, Slanderous mouths are loud against me.,1. 無欲自得的樣子。孟子．盡心上：「人知之，亦囂囂；人不知，亦囂囂。」2. 言語紛紜的樣子。詩經．小雅．十月之交：「無罪無辜，讒口囂囂。」,,,,,
509,翛翛,翛翛,xiāo xiāo,VISUAL,AA,,REDUPLICATION,鴟 鴞,GuoFeng,予羽譙譙、予尾翛翛、,My wings are all-injured; My tail is all-broken;,1. 鳥羽殘破的樣子。詩經．豳風．鴟鴞：「予羽譙譙，予尾翛翛。」2. 狀聲詞。形容雨聲。宋．蘇軾．舟行至清遠縣見顧秀才詩：「江雲漠漠桂花濕，海雨翛翛荔子然。」,,,,,,
510,瀟瀟,潇潇,xiāoxiāo,MOVEMENT+WETNESS,AA,,REDUPLICATION,風 雨,GuoFeng,風雨瀟瀟、雞鳴膠膠。,The wind whistles and the rain patters, While loudly crows the cock.,風狂雨驟的樣子。詩經．鄭風．風雨：「風雨瀟瀟，雞鳴膠膠。」明．無名氏．尋親記．第三齣：「雨瀟瀟似銀燭千條，瀉平地頓成滄海。」,Onomat. imitant le mugissement d’un vent violent et d’une pluie torrentielle.,,,,
511,嘵嘵,哓哓,xiāoxiāo,SOUND,AA,,REDUPLICATION,鴟 鴞,GuoFeng,風雨所漂搖、予維音嘵嘵。,It is tossed about in the wind and rain: I can but cry out with this note of alarm.,1. 恐懼聲。詩經．豳風．鴟鴞：「予室翹翹，風雨所漂搖，予維音嘵嘵。」2. 爭辯聲。唐．韓愈．重答張籍書：「擇其可語者誨之，猶時與吾悖，其聲嘵嘵。」3. 多言的樣子。初刻拍案驚奇．卷一：「口中嘵嘵說：『悔氣！來得遲了。』」聊齋志異．卷十．胭脂：「彼嘵嘵者直以桎梏靜之，何怪覆盆之下多沉冤哉！」,1. Pousser un cri d’effroi (spécial. pr les oiseaux). 2. Bruit de discussion, de dispute. Jacasser.,,,,
512,逍遙,逍遥,xiāoyáo,MOVEMENT,AB,*[s]ew *law,RHYME,清 人,GuoFeng,二矛重喬、河上乎逍遙。,And the two spears in it, with their hooks, rise one above the other. So do they saunter about by the He.,自由自在、不受拘束。亦作「消遙」。近悠閒。反落拓、拘束。莊子．讓王：「逍遙於天地之閒，而心意自得，吾何以天下為哉！」西遊記．第二回：「逐日家無拘無束，自在逍遙此一長生之美。」,,,,
513,逍遙,逍遥,xiāoyáo,MOVEMENT,AB,*[s]ew *law,RHYME,白 駒,XiaoYa,所謂伊人、於焉逍遙。,So may its owner of whom I think, Spend his time here at his ease!,自由自在、不受拘束。亦作「消遙」。近悠閒。反落拓、拘束。莊子．讓王：「逍遙於天地之閒，而心意自得，吾何以天下為哉！」西遊記．第二回：「逐日家無拘無束，自在逍遙此一長生之美。」,,,,,
762,偕偕,偕偕,xié xié,EVALUATION,AA,,REDUPLICATION,北 山,XiaoYa,偕偕士子、朝夕從事。,An officer, strong and vigorous, Morning and evening I am engaged in service.,強壯的樣子。詩經．小雅．北山：「偕偕士子，朝夕從事。」,,,,
514,騂騂,骍骍,xīng xīng,VISUAL+EVALUATION,AA,,REDUPLICATION,角 弓,XiaoYa,騂騂角弓、翩其反矣。,Well fashioned is the bow adorned with horn, And swift is its recoil.,調和的樣子。詩經．小雅．角弓：「騂騂角弓，翩其反矣。」晉．劉琨．答盧諶詩：「旌弓騂騂，輿馬翹翹。」,,,,,
515,欣欣,欣欣,xīnxīn,SMELL+EVALUATION,AA,,REDUPLICATION,鳬 鷖,DaYa,旨酒欣欣、燔炙芬芬、,"Your fine spirits are delicious, Your flesh, roast and broiled, is fragrant;",1. 喜悅的樣子。詩經．大雅．鳧鷖：「旨酒欣欣，燔炙芬芬。」楚辭．屈原．九歌．東皇太一：「五音紛兮繁會，君欣欣兮康樂。」2. 草木興盛繁榮的樣子。唐．張九齡．感遇詩十二首之一：「欣欣此生意，自爾為佳節。」宋．范成大．寒食郊行書事詩二首之二：「隴麥欣欣綠，山桃寂寂紅。」,1. Joyeux; content. 2. Content de soi; satisfait. 3. Luxuriant; en pleine croissance.,,,,,
516,休休,休休,xiū xiū,EVALUATION,AA,,REDUPLICATION,蟋 蟀,GuoFeng,好樂無荒、良士休休。,Let us not be wild in our love of enjoyment. The good man is quiet and serene.,1. 喜樂正道。詩經．唐風．蟋蟀：「好樂無荒，良士休休。」2. 寬容、好善。書經．秦誓：「其心休休焉，其如有容。」3. 退休。唐司空圖退隱，題其所建亭名為休休，見舊唐書．卷一九○．文苑傳下．司空圖傳。故以休休為退休意。宋．辛棄疾．鷓鴣天．枕簟溪堂冷欲秋詞：「書咄咄，且休休，一丘一壑也風流。」4. 失意、失志。宋．李清照．鳳凰臺上憶吹簫．香冷金猊詞：「休休，者回去也，千萬遍陽關，也則難留。」5. 狀聲詞。形容喘息、呼氣的聲音。6. 聊齋志異．卷二．阿寶：「生臥三日，氣休休若將澌滅。」7. 酒氣發散，使人肢體舒暢。宋．蘇軾．沐浴啟聖僧舍與趙德麟邂逅詩：「酒清不醉休休暖，睡穩如禪息息勻。」,1. Tranquille; modéré. 2. Bonté; honnêteté; compassion. Juste; probe. 3. Splendide; vigoureux.,,,,,
517,習習,习习,xíxí,MOVEMENT,AA,,REDUPLICATION,谷 風,GuoFeng,習習谷風、以陰以雨。,Gently blows the east wind, With cloudy skies and with rain.,1. 舒和的樣子。詩經．邶風．谷風：「習習谷風，以陰以雨。」儒林外史．第三十三回：「趁著這春光融融，和氣習習，憑在欄杆上，留連痛飲。」2. 飛動的樣子。文選．左思．詠史詩八首之八：「習習籠中鳥，舉翮觸四隅。」3. 盛多的樣子。文選．左思．魏都賦：「習習冠蓋，莘莘蒸徒。」4. 行走的樣子。文選．張衡．東京賦：「肅肅習習，隱隱轔轔。」,Bruit du vent d’Est qui souffle doucement, continuellement.,,,
518,習習,习习,xíxí,MOVEMENT,AA,,REDUPLICATION,谷 風,GuoFeng,習習谷風、維風及雨。,Gently blows the east wind; The wind followed by the rain.,1. 舒和的樣子。詩經．邶風．谷風：「習習谷風，以陰以雨。」儒林外史．第三十三回：「趁著這春光融融，和氣習習，憑在欄杆上，留連痛飲。」2. 飛動的樣子。文選．左思．詠史詩八首之八：「習習籠中鳥，舉翮觸四隅。」3. 盛多的樣子。文選．左思．魏都賦：「習習冠蓋，莘莘蒸徒。」4. 行走的樣子。文選．張衡．東京賦：「肅肅習習，隱隱轔轔。」,Bruit du vent d’Est qui souffle doucement, continuellement.,,,,
519,習習,习习,xíxí,MOVEMENT,AA,,REDUPLICATION,谷 風,GuoFeng,習習谷風、維風及頹。,Gently blows the east wind; And the wind is followed by the tornado.,1. 舒和的樣子。詩經．邶風．谷風：「習習谷風，以陰以雨。」儒林外史．第三十三回：「趁著這春光融融，和氣習習，憑在欄杆上，留連痛飲。」2. 飛動的樣子。文選．左思．詠史詩八首之八：「習習籠中鳥，舉翮觸四隅。」3. 盛多的樣子。文選．左思．魏都賦：「習習冠蓋，莘莘蒸徒。」4. 行走的樣子。文選．張衡．東京賦：「肅肅習習，隱隱轔轔。」,Bruit du vent d’Est qui souffle doucement, continuellement.,,,,
520,習習,习习,xíxí,MOVEMENT,AA,,REDUPLICATION,谷 風,GuoFeng,習習谷風、維山崔嵬。,Gently blows the east wind; And on the rock-covered tops of the hills.,1. 舒和的樣子。詩經．邶風．谷風：「習習谷風，以陰以雨。」儒林外史．第三十三回：「趁著這春光融融，和氣習習，憑在欄杆上，留連痛飲。」2. 飛動的樣子。文選．左思．詠史詩八首之八：「習習籠中鳥，舉翮觸四隅。」3. 盛多的樣子。文選．左思．魏都賦：「習習冠蓋，莘莘蒸徒。」4. 行走的樣子。文選．張衡．東京賦：「肅肅習習，隱隱轔轔。」,Bruit du vent d’Est qui souffle doucement, continuellement.,,,,
521,湑湑,湑湑,xǔ xǔ,VISUAL,AA,,REDUPLICATION,杕 杜,GuoFeng,有杕之杜、其葉湑湑。,There is a solitary russet pear tree, [But] its leaves are luxuriant.,1. 茂密繁盛的樣子。詩經．唐風．杕杜：「有杕之杜，其葉湑湑。」2.清風吹拂。唐．柳宗元．湘源二妃廟碑：「南風湑湑，湘水如舞。」,,,,,
776,訏訏,訏訏,xū xū,VISUAL,AA,,REDUPLICATION,韓 奕,DaYa,孔樂韓土、川澤訏訏、,Very pleasant is the territory of Han, With its large streams and meres,,形容廣大的樣子。詩經．大雅．韓奕：「孔樂韓土，川澤訏訏。」,,,,
522,鞙鞙,鞙鞙,xuàn xuàn,VISUAL,AA,,REDUPLICATION,大 東,XiaoYa,鞙鞙佩璲、不以其長。,If we give them long girdle-pendants with their stones, They do not think them long enough.,,long (en parl. de ces enfilades de pierres).,,,,
523,熏熏,熏熏,xūn xūn,EVALUATION,AA,,REDUPLICATION,鳬 鷖,DaYa,鳧鷖在亹、公尸來止熏熏。,"The wild ducks and widgeons are in the gorge; The personators of your ancestors rest, full of complacency.",1. 和悅的樣子。詩經．大雅．鳧鷖：「鳥鷖在亹，公尸來止熏熏。」文選．張衡．東京賦：「君臣歡康，具醉熏熏。」2. 眾多的樣子。漢．揚雄．太玄經．卷二．交：「往來熏熏，得亡之門。」,,,,,,
524,言言,言言,yán yán,SOUND,AA,,REDUPLICATION,公 劉,DaYa,于時言言、于時語語。,Here he told out his mind; Here he entered on deliberations.,1. 高大的樣子。詩經．大雅．皇矣：「臨衝閑閑，崇墉言言。」2. 每一句話。三國演義．第六十九回：「輅亹亹而談，言言精奧。」3. 和悅而恭敬的樣子。禮記．玉藻：「君子之飲酒也，受一爵而色洒如也，二爵而言言斯。」,"Haut; élevé (en parl. de murs, de remparts).",,,,,
525,言言,言言,yán yán,VISUAL,AA,,REDUPLICATION,皇 矣,DaYa,臨衝閑閑、崇墉言言。,"The engines of onfall and assault were gently plied, Against the walls of Chong high and great;",1. 高大的樣子。詩經．大雅．皇矣：「臨衝閑閑，崇墉言言。」2. 每一句話。三國演義．第六十九回：「輅亹亹而談，言言精奧。」3. 和悅而恭敬的樣子。禮記．玉藻：「君子之飲酒也，受一爵而色洒如也，二爵而言言斯。」,"Haut; élevé (en parl. de murs, de remparts).",,,,,
526,巖巖,岩岩,yán yán,VISUAL,AA,,REDUPLICATION,節 南 山,XiaoYa,節彼南山、維石巖巖。,Lofty is that southern hill, With its masses of rocks!,1. 高峻的樣子。詩經．小雅．節南山：「節彼南山，維石巖巖。」文選．潘岳．懷舊賦：「巖巖雙表，列列行楸。」2. 威嚴。晉．陶淵明．讀山海經詩十三首之十三：「巖巖顯朝市，帝者慎用才。」3. 瘦削的樣子。唐．薛能．吳姬詩十首之一：「夜鎖重門晝亦監，眼波嬌利瘦巖巖。」,,,,,
527,巖巖,岩岩,yán yán,VISUAL,AA,,REDUPLICATION,閟 宮,LuSong,泰山巖巖、魯邦所詹。,The mountain of Da is lofty, Looked up to by the State of Lu.,1. 高峻的樣子。詩經．小雅．節南山：「節彼南山，維石巖巖。」文選．潘岳．懷舊賦：「巖巖雙表，列列行楸。」2. 威嚴。晉．陶淵明．讀山海經詩十三首之十三：「巖巖顯朝市，帝者慎用才。」3. 瘦削的樣子。唐．薛能．吳姬詩十首之一：「夜鎖重門晝亦監，眼波嬌利瘦巖巖。」,,,,,
528,厭厭,厌厌,yàn yàn,FEELING,AA,,REDUPLICATION,湛 露,XiaoYa,厭厭夜飲、不醉無歸。,"Happily and long into the night we drink; Till all are drunk, there is no retiring.",1. 安靜的樣子。詩經．小雅．湛露：「厭厭夜飲，不醉無歸。」2. 茂盛的樣子。詩經．周頌．載芟：「厭厭其苗，綿綿其麃。」3. 露水重的樣子。元．鄭光祖．倩女離魂．第二折：「趁著這厭厭露華，對著這澄澄月下，驚的那呀呀呀寒鴈起平沙。」4. 暗淡、微弱的樣子。漢書．卷七十五．李尋傳：「列星皆失色，厭厭如滅。」5.虛弱生病的樣子。亦作「懨懨」。元．白樸．東牆記．第一折：「早是這兩日茶飯不進，厭厭瘦削。」初刻拍案驚奇．卷十六：「只是王氏生來嬌怯，厭厭弱病嘗不離身的。」,,,,,,
529,厭厭,厌厌,yàn yàn,FEELING,AA,,REDUPLICATION,湛 露,XiaoYa,厭厭夜飲、在宗載考。,Happily and long into the night we drink; In the honoured apartment we complete our carousal.,1. 安靜的樣子。詩經．小雅．湛露：「厭厭夜飲，不醉無歸。」2. 茂盛的樣子。詩經．周頌．載芟：「厭厭其苗，綿綿其麃。」3. 露水重的樣子。元．鄭光祖．倩女離魂．第二折：「趁著這厭厭露華，對著這澄澄月下，驚的那呀呀呀寒鴈起平沙。」4. 暗淡、微弱的樣子。漢書．卷七十五．李尋傳：「列星皆失色，厭厭如滅。」5.虛弱生病的樣子。亦作「懨懨」。元．白樸．東牆記．第一折：「早是這兩日茶飯不進，厭厭瘦削。」初刻拍案驚奇．卷十六：「只是王氏生來嬌怯，厭厭弱病嘗不離身的。」,,,,,,
530,咽咽,咽咽,yàn yàn,SOUND,AA,,REDUPLICATION,有 駜,LuSong,鼓咽咽、醉言舞。,The drums emit their deep sound; They drink to the full and then dance;,,Onomat. imitant le roulement de tambour.,,,,,
531,咽咽,咽咽,yàn yàn,SOUND,AA,,REDUPLICATION,有 駜,LuSong,鼓咽咽、醉言歸。,The drums emit their deep sound; They drink to the full and then return home;,,Onomat. imitant le roulement de tambour.,,,,,
532,厭厭,厌厌,yàn yàn,VISUAL,AA,,REDUPLICATION,載 芟,ZhouSong,厭厭其苗、綿綿其麃。,Luxuriant looks the young grain, And the weeders go among it in multitudes.,1. 安靜的樣子。詩經．小雅．湛露：「厭厭夜飲，不醉無歸。」2. 茂盛的樣子。詩經．周頌．載芟：「厭厭其苗，綿綿其麃。」3. 露水重的樣子。元．鄭光祖．倩女離魂．第二折：「趁著這厭厭露華，對著這澄澄月下，驚的那呀呀呀寒鴈起平沙。」4. 暗淡、微弱的樣子。漢書．卷七十五．李尋傳：「列星皆失色，厭厭如滅。」5.虛弱生病的樣子。亦作「懨懨」。元．白樸．東牆記．第一折：「早是這兩日茶飯不進，厭厭瘦削。」初刻拍案驚奇．卷十六：「只是王氏生來嬌怯，厭厭弱病嘗不離身的。」,,,,,
534,厭厭,厌厌,yàn yàn,VISUAL+EVALUATION,AA,,REDUPLICATION,小 戎,GuoFeng,厭厭良人、秩秩德音。,Tranquil and serene is the good man, With his virtuous fame spread far and near.,1. 安靜的樣子。詩經．小雅．湛露：「厭厭夜飲，不醉無歸。」2. 茂盛的樣子。詩經．周頌．載芟：「厭厭其苗，綿綿其麃。」3. 露水重的樣子。元．鄭光祖．倩女離魂．第二折：「趁著這厭厭露華，對著這澄澄月下，驚的那呀呀呀寒鴈起平沙。」4. 暗淡、微弱的樣子。漢書．卷七十五．李尋傳：「列星皆失色，厭厭如滅。」5.虛弱生病的樣子。亦作「懨懨」。元．白樸．東牆記．第一折：「早是這兩日茶飯不進，厭厭瘦削。」初刻拍案驚奇．卷十六：「只是王氏生來嬌怯，厭厭弱病嘗不離身的。」,,,,,
533,晏晏,晏晏,yàn yàn,VISUAL+EVALUATION,AA,,REDUPLICATION,氓,GuoFeng,總角之宴、言笑晏晏。,In the pleasant time of my girlhood, with my hair simply gathered in a knot, Harmoniously we talked and laughed.,柔和的樣子。詩經．衛風．氓：「總角之宴，言笑晏晏。」後漢書．卷四十三．何敞傳：「今國家秉聰明之弘道，明公履晏晏之純德，君臣相合，天下翕然」。,,,,
535,偃仰,偃仰,yǎn yǎng,VISUAL,AB,*ʔa[n]ʔ *[ŋ]aŋʔ,RHYME,北 山,XiaoYa,或棲遲偃仰、或王事鞅掌。,Some lazily roost, on their backs looking up, And some are all-bustled in the service of the king.,俯仰。詩經．小雅．北山：「或棲遲偃仰，或王事鞅掌。」,,,,
536,陽陽,阳阳,yáng yáng,FEELING,AA,,REDUPLICATION,君 子 陽 陽,GuoFeng,君子陽陽、左執簧、右招我由房。,My husband looks full of satisfaction. In his left hand he holds his reed-organ, And with his right he calls me to the room.,1. 和樂的樣子。詩經．王風．君子陽陽：「君子陽陽，左執簧，右招我由房。」2. 有文采的樣子。詩經．周頌．載見：「龍旂陽陽，和鈴央央。」3. 毫不在意的樣子。唐．韓愈．張中丞傳後敘：「巡就戮時，顏色不亂，陽陽如平常。」,,,,,
537,陽陽,阳阳,yáng yáng,VISUAL,AA,,REDUPLICATION,載 見,ZhouSong,龍旂陽陽、和鈴央央。,With their dargon-emblazoned banners, flying bright, The bells on them and their front-boards tinkling,,1. 和樂的樣子。詩經．王風．君子陽陽：「君子陽陽，左執簧，右招我由房。」2. 有文采的樣子。詩經．周頌．載見：「龍旂陽陽，和鈴央央。」3. 毫不在意的樣子。唐．韓愈．張中丞傳後敘：「巡就戮時，顏色不亂，陽陽如平常。」,,,
724,養養,养养,yǎng yǎng,FEELING,AA,,REDUPLICATION,二 子 乘 舟,GuoFeng,願言思子、中心養養。,I think longingly of them, And my heart is tossed about in uncertainty.,憂心不定的樣子。詩經．邶風．二子乘舟：「願言思子，中心養養。」,,,,,
538,央央,央央,yāng yāng,SOUND,AA,,REDUPLICATION,載 見,ZhouSong,龍旂陽陽、和鈴央央。,With their dargon-emblazoned banners, flying bright, The bells on them and their front-boards tinkling,,1. 鮮明的樣子。詩經．小雅．出車：「出車彭彭，旂旐央央。」2.形容和諧的聲音。或作「鉠鉠」。詩經．周頌．載見：「龍旂陽陽，和鈴央央。」3. 廣大。文選．司馬相如．長門賦：「撫柱楣以從容兮，覽曲臺之央央。」,1. Briller; resplendir; redéployer (étendards). 2. Retentir (en parl. des sonnettes du char).,,
541,央央,央央,yāng yāng,VISUAL,AA,,REDUPLICATION,采 芑,XiaoYa,方叔涖止、其車三千、旂旐央央。,"When Fang Shu came to take the command. His chariots were three thousand;His banners, with their blazonry of dragons, and of serpents and tortoises, fluttered gaily.",1. 鮮明的樣子。詩經．小雅．出車：「出車彭彭，旂旐央央。」2.形容和諧的聲音。或作「鉠鉠」。詩經．周頌．載見：「龍旂陽陽，和鈴央央。」3. 廣大。文選．司馬相如．長門賦：「撫柱楣以從容兮，覽曲臺之央央。」,1. Briller; resplendir; redéployer (étendards). 2. Retentir (en parl. des sonnettes du char).,,,,,
539,央央,央央,yāng yāng,VISUAL,AA,,REDUPLICATION,出 車,XiaoYa,出車彭彭、旂旐央央。,How numerous were his chariots! How splendid his dragon, his tortoise and serpent flags!,1. 鮮明的樣子。詩經．小雅．出車：「出車彭彭，旂旐央央。」2.形容和諧的聲音。或作「鉠鉠」。詩經．周頌．載見：「龍旂陽陽，和鈴央央。」3. 廣大。文選．司馬相如．長門賦：「撫柱楣以從容兮，覽曲臺之央央。」,1. Briller; resplendir; redéployer (étendards). 2. Retentir (en parl. des sonnettes du char).,,,,
540,央央,央央,yāng yāng,VISUAL,AA,,REDUPLICATION,六 月,XiaoYa,織文鳥章、白旆央央。,On our flags was their blazonry of birds, While their white streamers fluttered brightly.,1. 鮮明的樣子。詩經．小雅．出車：「出車彭彭，旂旐央央。」2.形容和諧的聲音。或作「鉠鉠」。詩經．周頌．載見：「龍旂陽陽，和鈴央央。」3. 廣大。文選．司馬相如．長門賦：「撫柱楣以從容兮，覽曲臺之央央。」,1. Briller; resplendir; redéployer (étendards). 2. Retentir (en parl. des sonnettes du char).,,,,
542,泱泱,泱泱,yāng yāng,VISUAL,AA,,REDUPLICATION,瞻 彼 洛 矣 ,XiaoYa,瞻彼洛矣、維水泱泱。,Look at the Luo, With its waters broad and deep.,1. 水深廣的樣子。詩經．小雅．瞻彼洛矣：「瞻彼洛矣，維水泱泱。」2. 雲氣騰湧的樣子。文選．潘岳．射雉賦：「天泱泱以垂雲，泉涓涓而吐溜。」3. 宏大的樣子。多指聲音而言。漢書．卷二十八．地理志下：「泱泱乎，大風也哉！其太公乎？國未可量也。」,1. Vaste et profond; immense. 2. Décrit un nuage qui se forme.,,,,
543,泱泱,泱泱,yāng yāng,VISUAL,AA,,REDUPLICATION,瞻 彼 洛 矣 ,XiaoYa,瞻彼洛矣、維水泱泱。,Look at the Luo, With its waters broad and deep.,1. 水深廣的樣子。詩經．小雅．瞻彼洛矣：「瞻彼洛矣，維水泱泱。」2. 雲氣騰湧的樣子。文選．潘岳．射雉賦：「天泱泱以垂雲，泉涓涓而吐溜。」3. 宏大的樣子。多指聲音而言。漢書．卷二十八．地理志下：「泱泱乎，大風也哉！其太公乎？國未可量也。」,1. Vaste et profond; immense. 2. Décrit un nuage qui se forme.,,,,
544,泱泱,泱泱,yāng yāng,VISUAL,AA,,REDUPLICATION,瞻 彼 洛 矣 ,XiaoYa,瞻彼洛矣、維水泱泱。,Look at the Luo, With its waters broad and deep.,1. 水深廣的樣子。詩經．小雅．瞻彼洛矣：「瞻彼洛矣，維水泱泱。」2. 雲氣騰湧的樣子。文選．潘岳．射雉賦：「天泱泱以垂雲，泉涓涓而吐溜。」3. 宏大的樣子。多指聲音而言。漢書．卷二十八．地理志下：「泱泱乎，大風也哉！其太公乎？國未可量也。」,1. Vaste et profond; immense. 2. Décrit un nuage qui se forme.,,,,
546,洋洋,洋洋,yángyáng,VISUAL,AA,,REDUPLICATION,衡 門,GuoFeng,泌之洋洋、可以樂飢。,By the wimpling stream from my fountain, I can joy amid my hunger.,1. 水勢盛大的樣子。詩經．衛風．碩人：「河水洋洋，北流活活。」宋．陳亮．水調歌頭．不見南師久詞：「自笑堂堂漢使，得似洋洋河水，依舊祇流東？」2. 廣闊無際的樣子。詩經．大雅．大明：「牧野洋洋，檀車煌煌。」3. 眾多貌。詩經．魯頌．閟宮：「萬舞洋洋，孝孫有慶。」4. 美善的樣子。書經．伊訓：「聖謨洋洋，嘉言孔彰。」5. 彷彿、想像。禮記．中庸：「盛服以承祭祀，洋洋乎如在其上。」6. 舒緩的樣子。孟子．萬章上：「始舍之，圉圉焉，少則洋洋焉，攸然而逝。」7. 充滿貌。禮記．中庸：「聖人之道，洋洋乎發育萬物。」紅樓夢．第二十一回：「看至此段，意趣洋洋，逞著酒興，不禁提筆。」8. 沒有歸宿、沒有依靠的樣子。楚辭．屈原．九章．哀郢：「順風波以從流兮，焉洋洋而為客。」9. 得意的樣子。宋．范仲淹．岳陽樓記：「登斯樓也，則有心曠神怡，寵辱皆忘，把酒臨風，其喜洋洋者矣。」10. 莊重敬慎的樣子。文選．傅毅．舞賦：「或有矜容愛儀，洋洋習習。」,Vaste; de grande portée; qui s’étend abondamment en grand nombre.,,,,
