NUMBER,TRAD,SIMPL,PINYIN,SEMANTIC,FORM-CHAR,Old-Chinese,FORM-MECH,TITLE,PoemGroup,LINE,TRANSLATION,ZDIC,RICCI,,,,,
210,孑孑,孑孑,jiéjié,VISUAL,AA,,REDUPLICATION,干 旄,GuoFeng,孑孑干旟、在浚之都。,Conspiciously rise the staffs with their falcon-banners, In the nearer suburbs of Jun,,1. 特出的樣子。詩經．鄘風．干旄：「孑孑干旄，在浚之郊。」2. 細小。唐．韓愈．原道：「彼以煦煦為仁，孑孑為義，其小之也則宜。」3.孤單。唐．韓愈．食曲河驛詩：「而我抱重罪，孑孑萬里程。親戚頓乖角，圖史棄縱橫。」,,,,
211,孑孑,孑孑,jiéjié,VISUAL,AA,,REDUPLICATION,干 旄,GuoFeng,孑孑干旌、在浚之城。,Conspiciously rise the staffs with their feathered streamers, At the walls of Jun,,1. 特出的樣子。詩經．鄘風．干旄：「孑孑干旄，在浚之郊。」2. 細小。唐．韓愈．原道：「彼以煦煦為仁，孑孑為義，其小之也則宜。」3.孤單。唐．韓愈．食曲河驛詩：「而我抱重罪，孑孑萬里程。親戚頓乖角，圖史棄縱橫。」,,,,
212,拮据,拮据,jiéjū,VISUAL,AB,*kˤi[t] *k(r)a,ALLITERATION,鴟 鴞,GuoFeng,予手拮据、予所捋荼、,With my claws I tore and held. Through the rushes which I gathered,,1. 辛勞操持。詩經．豳風．鴟鴞：「予手拮据，予所捋荼。」2. 境況窘迫，尤指經濟困難而言。近窘迫。反富裕、寬裕、裕如。紅樓夢．第一一四回：「手頭不濟，諸事拮据。」,,,,,
213,濟濟,济济,jǐjǐ,EVALUATION,AA,*[ts]ˤәjʔ [ts]ˤәjʔ,REDUPLICATION,楚 茨,XiaoYa,濟濟蹌蹌、絜爾牛羊、以往烝嘗。,With correct and reverent deportment, The oxen and sheep all pure, We proceed to the winter and autumnal sacrifices.,1. 形容人多，陣容盛大。詩經．大雅．文王：「濟濟多士，文王以寧。」2. 整齊雄美，有威儀的樣子。荀子．大略：「朝廷之美，濟濟鎗鎗。」文選．左思．詠史詩八首之四：「濟濟京城內，赫赫王侯居。」,,,,
214,濟濟,济济,jǐjǐ,EVALUATION,AA,*[ts]ˤәjʔ [ts]ˤәjʔ,REDUPLICATION,棫 樸,DaYa,濟濟辟王。,Elegant and dignified was our prince and king;,1. 形容人多，陣容盛大。詩經．大雅．文王：「濟濟多士，文王以寧。」2. 整齊雄美，有威儀的樣子。荀子．大略：「朝廷之美，濟濟鎗鎗。」文選．左思．詠史詩八首之四：「濟濟京城內，赫赫王侯居。」,,,,,,
215,濟濟,济济,jǐjǐ,EVALUATION,AA,*[ts]ˤәjʔ [ts]ˤәjʔ,REDUPLICATION,棫 樸,DaYa,濟濟辟王。,Elegant and dignified was our prince and king;,1. 形容人多，陣容盛大。詩經．大雅．文王：「濟濟多士，文王以寧。」2. 整齊雄美，有威儀的樣子。荀子．大略：「朝廷之美，濟濟鎗鎗。」文選．左思．詠史詩八首之四：「濟濟京城內，赫赫王侯居。」,,,,,,
219,濟濟,济济,jǐjǐ,VISUAL,AA,,REDUPLICATION,載 芟,ZhouSong,載穫濟濟、有實其積、萬億及秭。,"Then come the reapers in crowds, And the grain is piled up the fields, Myriads, and hundreds of thousands, and millions [of stacks];",1. 形容人多，陣容盛大。詩經．大雅．文王：「濟濟多士，文王以寧。」2. 整齊雄美，有威儀的樣子。荀子．大略：「朝廷之美，濟濟鎗鎗。」文選．左思．詠史詩八首之四：「濟濟京城內，赫赫王侯居。」,,,,,,
218,濟濟,济济,jǐjǐ,VISUAL,AA,,REDUPLICATION,清 廟,ZhouSong,濟濟多士、秉文之德。,Great was the number of the officers: [All] assiduous followers of the virtue of [king] Wen.,1. 形容人多，陣容盛大。詩經．大雅．文王：「濟濟多士，文王以寧。」2. 整齊雄美，有威儀的樣子。荀子．大略：「朝廷之美，濟濟鎗鎗。」文選．左思．詠史詩八首之四：「濟濟京城內，赫赫王侯居。」,,,,,,
216,濟濟,济济,jǐjǐ,VISUAL,AA,,REDUPLICATION,文 王,DaYa,濟濟多士、文王以寧。,Numerous is the array of officers, And by them king Wen enjoys his repose.,1. 形容人多，陣容盛大。詩經．大雅．文王：「濟濟多士，文王以寧。」2. 整齊雄美，有威儀的樣子。荀子．大略：「朝廷之美，濟濟鎗鎗。」文選．左思．詠史詩八首之四：「濟濟京城內，赫赫王侯居。」,,,,,
217,濟濟,济济,jǐjǐ,VISUAL,AA,,REDUPLICATION,旱 麓,DaYa,瞻彼旱麓、榛楛濟濟。,Look at the foot of the Han, How abundantly grow the hazel and the arrow-thorn!,1. 形容人多，陣容盛大。詩經．大雅．文王：「濟濟多士，文王以寧。」2. 整齊雄美，有威儀的樣子。荀子．大略：「朝廷之美，濟濟鎗鎗。」文選．左思．詠史詩八首之四：「濟濟京城內，赫赫王侯居。」,,,,,
220,濟濟,济济,jǐjǐ,VISUAL,AA,,REDUPLICATION,泮 水,LuSong,濟濟多士、克廣德心。,His numerous officers, Men who have enlarged their virtuous minds,,1. 形容人多，陣容盛大。詩經．大雅．文王：「濟濟多士，文王以寧。」2. 整齊雄美，有威儀的樣子。荀子．大略：「朝廷之美，濟濟鎗鎗。」文選．左思．詠史詩八首之四：「濟濟京城內，赫赫王侯居。」,,,,
222,濟濟,济济,jǐjǐ,VISUAL+EVALUATION,AA,,REDUPLICATION,公 劉,DaYa,蹌蹌濟濟、俾筵俾几。,"With his officers all in dignified order, He caused mats to be spread, with stools upon them;",1. 形容人多，陣容盛大。詩經．大雅．文王：「濟濟多士，文王以寧。」2. 整齊雄美，有威儀的樣子。荀子．大略：「朝廷之美，濟濟鎗鎗。」文選．左思．詠史詩八首之四：「濟濟京城內，赫赫王侯居。」,,,,,,
221,濟濟,济济,jǐjǐ,VISUAL+EVALUATION,AA,,REDUPLICATION,載 驅,GuoFeng,四驪濟濟、垂轡濔濔。,Her four black horses are beautiful, And soft look the reins as they hang.,1. 形容人多，陣容盛大。詩經．大雅．文王：「濟濟多士，文王以寧。」2. 整齊雄美，有威儀的樣子。荀子．大略：「朝廷之美，濟濟鎗鎗。」文選．左思．詠史詩八首之四：「濟濟京城內，赫赫王侯居。」,,,,,
756,矜矜,矜矜,jīn jīn,EVALUATION,AA,,REDUPLICATION,無 羊,XiaoYa,爾羊來思、矜矜兢兢、不騫不崩。,Your sheep come, Vigorous and strong, None injured, no infection in the herd.,1. 堅強的樣子。詩經．小雅．無羊：「矜矜兢兢，不騫不崩。」2. 形容戒慎危懼的樣子。後漢書．卷三十下．郎顗傳：「豈可不剛健篤實，矜矜慄慄，以守天功盛德大業乎？」三國志．卷二十五．魏書．高堂隆傳：「畏上天之明命，循陰陽之逆順，矜矜業業，惟恐有違。」,,,
225,兢兢,兢兢,jīng jīng,FEELING,AA,,REDUPLICATION,雲 漢,DaYa,兢兢業業、如霆如雷。,I am full of terror and feel the peril, Like the clap of thunder or the roll.,小心謹慎的樣子。書經．皋陶謨：「無教逸欲有邦，兢兢業業，一日二日萬幾。」,,,,,
226,兢兢,兢兢,jīng jīng,FEELING,AA,,REDUPLICATION,召 旻 ,DaYa,兢兢業業、孔填不寧、我位孔貶。,We, careful and feeling in peril, For long in unrest, Are constantly subjected to degradation,小心謹慎的樣子。書經．皋陶謨：「無教逸欲有邦，兢兢業業，一日二日萬幾。」,,,
224,兢兢,兢兢,jīng jīng,FEELING,AA,,REDUPLICATION,小 宛,XiaoYa,戰戰兢兢、如履薄冰。,We must be apprehensive and cautious, As if we were treading upon thin ice.,小心謹慎的樣子。書經．皋陶謨：「無教逸欲有邦，兢兢業業，一日二日萬幾。」,,,,,
223,兢兢,兢兢,jīng jīng,FEELING,AA,,REDUPLICATION,小 旻,XiaoYa,戰戰兢兢、如臨深淵、如履薄冰。,We should be apprehensive and careful, As if we were on the brink of a deep gulf, As if we were treading on thin ice.,小心謹慎的樣子。書經．皋陶謨：「無教逸欲有邦，兢兢業業，一日二日萬幾。」,,,,
227,菁菁,菁菁,jīng jīng,VISUAL,AA,,REDUPLICATION,菁 菁 者 莪 ,XiaoYa,菁菁者莪、在彼中陵。,Luxuriantly grows the aster-southernwood, In the midst of that great height.,草木茂盛的樣子。亦作「青青」。詩經．小雅．菁菁：「菁菁者莪，在彼中阿，既見君子，樂且有儀。」詩經小雅的篇名。共四章。根據詩序：「菁菁者莪，樂育材也。」首章二句為：「菁菁者莪，在彼中阿。」菁菁，茂盛的樣子。,,,,,
228,菁菁,菁菁,jīng jīng,VISUAL,AA,,REDUPLICATION,菁 菁 者 莪 ,XiaoYa,菁菁者莪、在彼中陵。,Luxuriantly grows the aster-southernwood, In the midst of that great height.,草木茂盛的樣子。亦作「青青」。詩經．小雅．菁菁：「菁菁者莪，在彼中阿，既見君子，樂且有儀。」詩經小雅的篇名。共四章。根據詩序：「菁菁者莪，樂育材也。」首章二句為：「菁菁者莪，在彼中阿。」菁菁，茂盛的樣子。,,,,,
229,兢兢,兢兢,jīng jīng,VISUAL+EVALUATION,AA,,REDUPLICATION,無 羊,XiaoYa,爾羊來思、矜矜兢兢、不騫不崩。,Your sheep come, Vigorous and strong, None injured, no infection in the herd.,小心謹慎的樣子。書經．皋陶謨：「無教逸欲有邦，兢兢業業，一日二日萬幾。」,,,
230,京京,京京,jīngjīng,FEELING,AA,,REDUPLICATION,正 月,XiaoYa,念我獨兮、憂心京京。,I think how I stand alone, And the sorrow of my heart grows intense.,憂愁不絕的樣子。詩經．小雅．正月：「念我獨兮，憂心京京。」後漢書．卷五．孝安帝紀：「夙夜克己，憂心京京。」,,,,,
232,菁菁,菁菁,jīngjīng,VISUAL,AA,,REDUPLICATION,菁 菁 者 莪 ,XiaoYa,菁菁者莪、在彼中沚。,Luxuriantly grows the aster-southernwood, In the midst of that islet.,草木茂盛的樣子。亦作「青青」。詩經．小雅．菁菁：「菁菁者莪，在彼中阿，既見君子，樂且有儀。」詩經小雅的篇名。共四章。根據詩序：「菁菁者莪，樂育材也。」首章二句為：「菁菁者莪，在彼中阿。」菁菁，茂盛的樣子。,,,,,
231,菁菁,菁菁,jīngjīng,VISUAL,AA,,REDUPLICATION,杕 杜,GuoFeng,有杕之杜、其葉菁菁。,There is a solitary russet pear tree, [But] its leaves are abundant.,草木茂盛的樣子。亦作「青青」。詩經．小雅．菁菁：「菁菁者莪，在彼中阿，既見君子，樂且有儀。」詩經小雅的篇名。共四章。根據詩序：「菁菁者莪，樂育材也。」首章二句為：「菁菁者莪，在彼中阿。」菁菁，茂盛的樣子。,,,,,
233,斤斤,斤斤,jīnjīn,EVALUATION,AA,,REDUPLICATION,執 競,ZhouSong,自彼成康、奄有四方、斤斤其明。,When we consider how Cheng and Kang, Grandly held all within the four quarters [of the kingdom], How penetrating was their intelligence!,1. 明察。詩經．周頌．執競：「自彼成康，奄有四方，斤斤其明。」2. 謹慎。後漢書．卷十八．吳漢傳：「及在朝廷，斤斤謹質，形於體貌。」聊齋志異．卷十二．錦瑟：「婢頗風格，既熟，頗以眉目送情。生斤斤自守，不敢少致差跌。」3. 計較細處。如：「斤斤愛惜」、「斤斤於小節」。,1. Perspicace; clair; lucide (en parl. de l’intelligence de qn). 2. Attentif jusqu’aux moindres détails; minutieux; plein d’attention (pour autrui).,,,
234,駉駉,駉駉,jiōng jiōng,VISUAL+EVALUATION,AA,,REDUPLICATION,駉,LuSong,駉駉牡馬、在坰之野。,Fat and large are the stallions, On the plains of the far-distant borders.,馬肥壯的樣子。詩經．魯頌．駉：「駉駉牡馬，在坰之野。」,,,,,
235,駉駉,駉駉,jiōng jiōng,VISUAL+EVALUATION,AA,,REDUPLICATION,駉,LuSong,駉駉牡馬、在坰之野。,"His thoughts are without limit; He thinks of his horses, and they are thus good.",馬肥壯的樣子。詩經．魯頌．駉：「駉駉牡馬，在坰之野。」,,,,,,
236,駉駉,駉駉,jiōng jiōng,VISUAL+EVALUATION,AA,,REDUPLICATION,駉,LuSong,駉駉牡馬、在坰之野。,"His thoughts are without end; He thinks of his horses, and they are thus strong.",馬肥壯的樣子。詩經．魯頌．駉：「駉駉牡馬，在坰之野。」,,,,,,
237,駉駉,駉駉,jiōng jiōng,VISUAL+EVALUATION,AA,,REDUPLICATION,駉,LuSong,駉駉牡馬、在坰之野。,"His thoughts never weary; He thinks of his horses, and such they become.",馬肥壯的樣子。詩經．魯頌．駉：「駉駉牡馬，在坰之野。」,,,,,,
238,究究,究究,jiū jiū,EVALUATION,AA,,REDUPLICATION,羔 裘,GuoFeng,羔裘豹褎、自我人究究。,Lamb's fur and leopard's cuffs, You use us with cruel unkindness.,1. 憎惡而不相親近的樣子。詩經．唐風．羔裘：「羔裘豹褎，自我人究究。」2. 不停的樣子。楚辭．劉向．九歎．遠逝：「遭傾遇禍不可救兮，長吟永欷涕究究兮。」,1. En désaccord; qui ne s’entendent pas; qui se cherchent malignement; qui se détestent mutuellement. 2. Sans cesse; sans arrêt.,,,,
239,糾糾,纠纠,jiū jiū,VISUAL,AA,,REDUPLICATION,葛 屨,GuoFeng,糾糾葛屨、可以履霜。,Shoes thinly woven of the dolichos fibre, May be used to walk on the hoarfrost.,1. 纏繞的樣子。詩經．魏風．葛屨：「糾糾葛屨，可以履霜。」2. 雄壯勇武的樣子。亦作「赳赳」。a後漢書．卷三十七．桓榮傳．章懷太子．注引謝承書曰：「上嘗歎曰：『糾糾武夫，公侯干城，何湯之謂也。』」,,,,,
240,糾糾,纠纠,jiū jiū,VISUAL,AA,,REDUPLICATION,大 東,XiaoYa,糾糾葛屨、可以履霜。,Thin shoes of dolichos fibre, Are made to serve to walk on the hoar-frost,1. 纏繞的樣子。詩經．魏風．葛屨：「糾糾葛屨，可以履霜。」2. 雄壯勇武的樣子。亦作「赳赳」。a後漢書．卷三十七．桓榮傳．章懷太子．注引謝承書曰：「上嘗歎曰：『糾糾武夫，公侯干城，何湯之謂也。』」,,,,,
241,赳赳,赳赳,jiū jiū,VISUAL+EVALUATION,AA,,REDUPLICATION,兔 罝,GuoFeng,赳赳武夫、公侯干城。,That stalwart, martial man Might be shield and wall to his prince.,雄壯勇武的樣子。亦作「糾糾」。詩經．周南．兔罝：「赳赳武夫，公侯干城。」,,,,,
242,赳赳,赳赳,jiū jiū,VISUAL+EVALUATION,AA,,REDUPLICATION,兔 罝,GuoFeng,赳赳武夫、公侯好仇。,That stalwart, martial man Would be a good companion for his prince.,雄壯勇武的樣子。亦作「糾糾」。詩經．周南．兔罝：「赳赳武夫，公侯干城。」,,,,,
243,赳赳,赳赳,jiū jiū,VISUAL+EVALUATION,AA,,REDUPLICATION,兔 罝,GuoFeng,赳赳武夫、公侯腹心。,That stalwart, martial man Might be head and heart to his prince.,雄壯勇武的樣子。亦作「糾糾」。詩經．周南．兔罝：「赳赳武夫，公侯干城。」,,,,,
244,瞿瞿,瞿瞿,jù jù,VISUAL,AA,,REDUPLICATION,東 方 未 明,GuoFeng,折柳樊圃、狂夫瞿瞿。,You fence your garden with branches of willow, And the reckless fellows stand in awe.,,1. Jeter un coup d’œil rapide et tout étonné. 2. Avoir un regard exprimant la peur. 3. Avec attention; attentivement; consciencieusement; avec diligence. 4. Visage triste et endeuillé lors des funérailles.,,,,
245,瞿瞿,瞿瞿,jù jù,VISUAL,AA,,REDUPLICATION,蟋 蟀,GuoFeng,好樂無荒、良士瞿瞿。,Let us not be wild in our love of enjoyment. The good man is anxiously thoughtful.,,1. Jeter un coup d’œil rapide et tout étonné. 2. Avoir un regard exprimant la peur. 3. Avec attention; attentivement; consciencieusement; avec diligence. 4. Visage triste et endeuillé lors des funérailles.,,,,,
246,踽踽,踽踽,jǔ jǔ,FEELING,AA,,REDUPLICATION,杕 杜,GuoFeng,獨行踽踽。,Alone I walk unbefriended;,孤單行走的樣子。詩經．唐風．杕杜：「獨行踽踽，豈無他人，不如我同父？」,,,,,,
247,居居,居居,jū jū,EVALUATION,AA,,REDUPLICATION,羔 裘,GuoFeng,羔裘豹袪、自我人居居。,Lamb's fur and leopard's cuffs, You use us with unkindness.,1. 懷惡不相親附的樣子。詩經．唐風．羔裘：「羔裘豹袪，自我人居居。」2. 安靜的樣子。莊子．盜跖：「神農之世，臥則居居，起則于于。」漢．王充．論衡．自然：「三皇之時，坐者于于，行者居居。」,Avec orgueil, mépris, sévérité.,,
248,沮洳,沮洳,jù rù,VISUAL,AA,,REDUPLICATION,汾 沮 洳,GuoFeng,彼汾沮洳、言采其莫。,There in the oozy grounds of the Fen, They gather the sorrel.,低溼的地方。詩經．魏風．汾沮洳：「彼汾沮洳，言采其莫。」元．王惲．輓漕篇：「發源本清淺，才夏即沮洳。」,Marais; terrain marécageux. Humide; boueux.,,,,
249,睠睠,眷眷,juànjuàn,VISUAL,AA,,REDUPLICATION,小 明 ,XiaoYa,念彼共人、睠睠懷顧。,I think of those [at court] in their offices, Looking back to them with fond regard.,,,,,,
250,蹶蹶,蹶蹶,jué jué,EVALUATION,AA,,REDUPLICATION,蟋 蟀,GuoFeng,好樂無荒、良士蹶蹶。,Let us not be wild in our love of enjoyment. The good man is ever diligent.,1. 動作敏捷的樣子。詩經．唐風．蟋蟀：「好樂無荒，良士蹶蹶。」孔穎達．正義：「釋詁云：『蹶，動也。』釋訓云：『蹶蹶，敏也。』」2.驚動的樣子。莊子．至樂：「俄而柳生其左肘，其意蹶蹶然惡之。」成玄英．疏：「蹶蹶，驚動貌。」,,,,,,
251,豈弟,岂弟,kǎi tì,EVALUATION,AB,*C.qʰəjʔ *lˤəjʔ,RHYME,載 驅,GuoFeng,魯道有蕩、齊子豈弟。,The way from Lu is easy and plain, And the daughter of Qi is delighted and complacent.,和樂的樣子。詩經．小雅．蓼蕭：「既見君子，孔燕豈弟。」,D’un commerce agréable et facile.,,,,
254,豈弟,岂弟,kǎi tì,EVALUATION,AB,*C.qʰəjʔ *lˤəjʔ,RHYME,青 蠅,XiaoYa,豈弟君子、無信讒言。,O happy and courteous sovereign, Do not believe slanderous speeches.,和樂的樣子。詩經．小雅．蓼蕭：「既見君子，孔燕豈弟。」,D’un commerce agréable et facile.,,,,
253,豈弟,岂弟,kǎi tì,EVALUATION,AB,*C.qʰəjʔ *lˤəjʔ,RHYME,湛 露,XiaoYa,豈弟君子、莫不令儀。,Happy and self-possessed are my noble guests, Every one of them of excellent deportment.,和樂的樣子。詩經．小雅．蓼蕭：「既見君子，孔燕豈弟。」,D’un commerce agréable et facile.,,,,
263,豈弟,岂弟,kǎi tì,EVALUATION,AB,*C.qʰəjʔ *lˤəjʔ,RHYME,卷 阿,DaYa,豈弟君子、來游來歌、,"There was [our] happy, courteous sovereign, Rambling and singing;",和樂的樣子。詩經．小雅．蓼蕭：「既見君子，孔燕豈弟。」,D’un commerce agréable et facile.,,,,,
264,豈弟,岂弟,kǎi tì,EVALUATION,AB,*C.qʰəjʔ *lˤəjʔ,RHYME,卷 阿,DaYa,豈弟君子、俾爾彌爾性、,O happy and courteous sovereign, May you fulfill your years,,和樂的樣子。詩經．小雅．蓼蕭：「既見君子，孔燕豈弟。」,D’un commerce agréable et facile.,,,
265,豈弟,岂弟,kǎi tì,EVALUATION,AB,*C.qʰəjʔ *lˤəjʔ,RHYME,卷 阿,DaYa,豈弟君子、俾爾彌爾性、,O happy and courteous sovereign, May you fulfill your years,,和樂的樣子。詩經．小雅．蓼蕭：「既見君子，孔燕豈弟。」,D’un commerce agréable et facile.,,,
266,豈弟,岂弟,kǎi tì,EVALUATION,AB,*C.qʰəjʔ *lˤəjʔ,RHYME,卷 阿,DaYa,豈弟君子、俾爾彌爾性、,O happy and courteous sovereign, May you fulfill your years,,和樂的樣子。詩經．小雅．蓼蕭：「既見君子，孔燕豈弟。」,D’un commerce agréable et facile.,,,
267,豈弟,岂弟,kǎi tì,EVALUATION,AB,*C.qʰəjʔ *lˤəjʔ,RHYME,卷 阿,DaYa,豈弟君子、四方為則 。,[So that], O happy and courteous sovereign, You are a pattern to the four quarters [of the kingdom].,和樂的樣子。詩經．小雅．蓼蕭：「既見君子，孔燕豈弟。」,D’un commerce agréable et facile.,,,
268,豈弟,岂弟,kǎi tì,EVALUATION,AB,*C.qʰəjʔ *lˤəjʔ,RHYME,卷 阿,DaYa,豈弟君子、四方為綱 。,O happy and courteous sovereign, [Through them] the four quarters [of the kingdom] are guided by you.,和樂的樣子。詩經．小雅．蓼蕭：「既見君子，孔燕豈弟。」,D’un commerce agréable et facile.,,,,
255,豈弟,岂弟,kǎi tì,EVALUATION,AB,*C.qʰəjʔ *lˤəjʔ,RHYME,旱 麓,DaYa,豈弟君子、于祿豈弟。,Easy and self-possessed was our prince, In his pursuit of dignity [still] easy and self-possessed!,和樂的樣子。詩經．小雅．蓼蕭：「既見君子，孔燕豈弟。」,D’un commerce agréable et facile.,,,,
256,豈弟,岂弟,kǎi tì,EVALUATION,AB,*C.qʰəjʔ *lˤəjʔ,RHYME,旱 麓,DaYa,豈弟君子、于祿豈弟。,Easy and self-possessed was our prince, In his pursuit of dignity [still] easy and self-possessed!,和樂的樣子。詩經．小雅．蓼蕭：「既見君子，孔燕豈弟。」,D’un commerce agréable et facile.,,,,
257,豈弟,岂弟,kǎi tì,EVALUATION,AB,*C.qʰəjʔ *lˤəjʔ,RHYME,旱 麓,DaYa,豈弟君子、遐不作人。,Easy and self-possessed was our-prince; Did he not exert an influence upon men?,和樂的樣子。詩經．小雅．蓼蕭：「既見君子，孔燕豈弟。」,D’un commerce agréable et facile.,,,,,
258,豈弟,岂弟,kǎi tì,EVALUATION,AB,*C.qʰəjʔ *lˤəjʔ,RHYME,旱 麓,DaYa,豈弟君子、神所勞矣。,Easy and self-possessed was our prince, Cheered and encouraged by the Spirits.,和樂的樣子。詩經．小雅．蓼蕭：「既見君子，孔燕豈弟。」,D’un commerce agréable et facile.,,,,
259,豈弟,岂弟,kǎi tì,EVALUATION,AB,*C.qʰəjʔ *lˤəjʔ,RHYME,旱 麓,DaYa,豈弟君子、求福不回。,Easy and self-possessed was our prince, Seeking for happiness by no crooked ways.,和樂的樣子。詩經．小雅．蓼蕭：「既見君子，孔燕豈弟。」,D’un commerce agréable et facile.,,,,
252,豈弟,岂弟,kǎi tì,EVALUATION,AB,*C.qʰəjʔ *lˤəjʔ,RHYME,蓼 蕭,XiaoYa,既見君子、孔燕豈弟。,Now that I see my noble men, Grandly we feast, delighted and complacent.,和樂的樣子。詩經．小雅．蓼蕭：「既見君子，孔燕豈弟。」,D’un commerce agréable et facile.,,,
260,豈弟,岂弟,kǎi tì,EVALUATION,AB,*C.qʰəjʔ *lˤəjʔ,RHYME,泂 酌,DaYa,豈弟君子、民之父母 。,[How much more should] the happy and courteous sovereign, Be the parent of the people!,和樂的樣子。詩經．小雅．蓼蕭：「既見君子，孔燕豈弟。」,D’un commerce agréable et facile.,,,,
261,豈弟,岂弟,kǎi tì,EVALUATION,AB,*C.qʰəjʔ *lˤəjʔ,RHYME,泂 酌,DaYa,豈弟君子、民之攸歸 。,[How much more should] the happy and courteous sovereign, Be the centre of attraction to the people!,和樂的樣子。詩經．小雅．蓼蕭：「既見君子，孔燕豈弟。」,D’un commerce agréable et facile.,,,,
262,豈弟,岂弟,kǎi tì,EVALUATION,AB,*C.qʰəjʔ *lˤəjʔ,RHYME,泂 酌,DaYa,豈弟君子、民之攸塈 。,[How much more should] the happy and courteous sovereign, Be the centre of rest to the people!,和樂的樣子。詩經．小雅．蓼蕭：「既見君子，孔燕豈弟。」,D’un commerce agréable et facile.,,,,
269,坎坎,坎坎,kǎn kǎn,SOUND,AA,,REDUPLICATION,伐 檀,GuoFeng,坎坎伐檀兮、寘之河之干兮,Kan-kan go his blows on the sandal trees, And he places what he hews on the river's bank,,1. 擊鼓聲。詩經．小雅．伐木：「坎坎鼓我，蹲蹲舞我。」2. 伐木聲。詩經．魏風．伐檀：「坎坎伐檀兮，寘之河之干兮。」3. 不安的樣子。易經．坎卦：「六三，來之坎坎，險且枕。」4. 空乏的樣子。漢．揚雄．太玄經．窮：「羹無糝，其腹坎坎。」5. 不平。唐．柳宗元．弔屈原文：「哀余衷之坎坎兮，獨蘊憤而增傷。」6. 高興、歡喜。爾雅．釋訓：「坎坎、蹲蹲，喜也。」,1. Onomat. imitant le son du tambour. 2. Onomat. imitant le bruit de coups violents. 3. Vide (en parl. de la bourse); creux (en parl. du ventre). 4. Agité (en parl. du cœur).,,,
270,坎坎,坎坎,kǎn kǎn,SOUND,AA,,REDUPLICATION,伐 檀,GuoFeng,坎坎伐輻兮、寘之河之側兮,Kan-kan go his blows on the wood for his spokes, And he places it by the side of the river,,1. 擊鼓聲。詩經．小雅．伐木：「坎坎鼓我，蹲蹲舞我。」2. 伐木聲。詩經．魏風．伐檀：「坎坎伐檀兮，寘之河之干兮。」3. 不安的樣子。易經．坎卦：「六三，來之坎坎，險且枕。」4. 空乏的樣子。漢．揚雄．太玄經．窮：「羹無糝，其腹坎坎。」5. 不平。唐．柳宗元．弔屈原文：「哀余衷之坎坎兮，獨蘊憤而增傷。」6. 高興、歡喜。爾雅．釋訓：「坎坎、蹲蹲，喜也。」,1. Onomat. imitant le son du tambour. 2. Onomat. imitant le bruit de coups violents. 3. Vide (en parl. de la bourse); creux (en parl. du ventre). 4. Agité (en parl. du cœur).,,,
271,坎坎,坎坎,kǎn kǎn,SOUND,AA,,REDUPLICATION,伐 檀,GuoFeng,坎坎伐輪兮、寘之河之漘兮、,Kan-kan go his blows on the wood for his wheels, And he places it by the lip of the river,,1. 擊鼓聲。詩經．小雅．伐木：「坎坎鼓我，蹲蹲舞我。」2. 伐木聲。詩經．魏風．伐檀：「坎坎伐檀兮，寘之河之干兮。」3. 不安的樣子。易經．坎卦：「六三，來之坎坎，險且枕。」4. 空乏的樣子。漢．揚雄．太玄經．窮：「羹無糝，其腹坎坎。」5. 不平。唐．柳宗元．弔屈原文：「哀余衷之坎坎兮，獨蘊憤而增傷。」6. 高興、歡喜。爾雅．釋訓：「坎坎、蹲蹲，喜也。」,1. Onomat. imitant le son du tambour. 2. Onomat. imitant le bruit de coups violents. 3. Vide (en parl. de la bourse); creux (en parl. du ventre). 4. Agité (en parl. du cœur).,,,
