NUMBER,TRAD,SIMPL,PINYIN,SEMANTIC,FORM-CHAR,Old-Chinese,FORM-MECH,TITLE,PoemGroup,LINE,TRANSLATION,ZDIC,RICCI,,,,,
375,翩翩,翩翩,piānpiān,MOVEMENT,AA,,REDUPLICATION,巷 伯,XiaoYa,緝緝翩翩、謀欲譖人。,With babbling mouths you go about, Scheming and wishing to slander others,,1. 鳥輕飛的樣子。文選．曹植．贈白馬王彪詩：「歸鳥赴喬林，翩翩厲羽翼。」唐．白居易．燕詩示劉叟詩：「梁上有雙燕，翩翩雄與雌。」2.行動輕快的樣子。楚辭．屈原．九歌．湘君：「石瀨兮淺淺，飛龍兮翩翩。」唐．白居易．新樂府．賣炭翁：「兩騎翩翩來是誰？黃衣使者白衫兒。」如：「翩翩起舞」。3.往來的樣子。亦作「幡幡」。文選．左思．吳都賦：「其鄰則有任俠之靡，輕訬之客，締交翩翩，儐從弈弈。」4.自得自喜的樣子。文選．張華．鷦鷯賦：「翩翩然，有以自樂也。」5. 形容文采風流的樣子。文選．曹丕．與吳質書：「元瑜書記翩翩，致足樂也。」6.形容舉止灑脫的樣子。初刻拍案驚奇．卷三十四：「在門縫裡窺看，只見聞人生逸致翩翩，有出塵之態。」,,,,
372,翩翩,翩翩,piānpiān,MOVEMENT,AA,,REDUPLICATION,四 牡,XiaoYa,翩翩者鵻、載飛載下、集于苞栩。,"The Filial doves keep flying about, Now soaring aloft, and now descending, Collecting on the bushy oaks;",1. 鳥輕飛的樣子。文選．曹植．贈白馬王彪詩：「歸鳥赴喬林，翩翩厲羽翼。」唐．白居易．燕詩示劉叟詩：「梁上有雙燕，翩翩雄與雌。」2.行動輕快的樣子。楚辭．屈原．九歌．湘君：「石瀨兮淺淺，飛龍兮翩翩。」唐．白居易．新樂府．賣炭翁：「兩騎翩翩來是誰？黃衣使者白衫兒。」如：「翩翩起舞」。3.往來的樣子。亦作「幡幡」。文選．左思．吳都賦：「其鄰則有任俠之靡，輕訬之客，締交翩翩，儐從弈弈。」4.自得自喜的樣子。文選．張華．鷦鷯賦：「翩翩然，有以自樂也。」5. 形容文采風流的樣子。文選．曹丕．與吳質書：「元瑜書記翩翩，致足樂也。」6.形容舉止灑脫的樣子。初刻拍案驚奇．卷三十四：「在門縫裡窺看，只見聞人生逸致翩翩，有出塵之態。」,,,,,,
373,翩翩,翩翩,piānpiān,MOVEMENT,AA,,REDUPLICATION,四 牡,XiaoYa,翩翩者鵻、載飛載止、集于苞杞。,"The Filial doves keep flying about, Now flying, now stopping, Collecting on the bushy medlars;",1. 鳥輕飛的樣子。文選．曹植．贈白馬王彪詩：「歸鳥赴喬林，翩翩厲羽翼。」唐．白居易．燕詩示劉叟詩：「梁上有雙燕，翩翩雄與雌。」2.行動輕快的樣子。楚辭．屈原．九歌．湘君：「石瀨兮淺淺，飛龍兮翩翩。」唐．白居易．新樂府．賣炭翁：「兩騎翩翩來是誰？黃衣使者白衫兒。」如：「翩翩起舞」。3.往來的樣子。亦作「幡幡」。文選．左思．吳都賦：「其鄰則有任俠之靡，輕訬之客，締交翩翩，儐從弈弈。」4.自得自喜的樣子。文選．張華．鷦鷯賦：「翩翩然，有以自樂也。」5. 形容文采風流的樣子。文選．曹丕．與吳質書：「元瑜書記翩翩，致足樂也。」6.形容舉止灑脫的樣子。初刻拍案驚奇．卷三十四：「在門縫裡窺看，只見聞人生逸致翩翩，有出塵之態。」,,,,,,
374,翩翩,翩翩,piānpiān,MOVEMENT,AA,,REDUPLICATION,南 有 嘉 魚,XiaoYa,翩翩者鵻、烝然來思。,The Filial doves keep flying about, Coming in multitudes.,1. 鳥輕飛的樣子。文選．曹植．贈白馬王彪詩：「歸鳥赴喬林，翩翩厲羽翼。」唐．白居易．燕詩示劉叟詩：「梁上有雙燕，翩翩雄與雌。」2.行動輕快的樣子。楚辭．屈原．九歌．湘君：「石瀨兮淺淺，飛龍兮翩翩。」唐．白居易．新樂府．賣炭翁：「兩騎翩翩來是誰？黃衣使者白衫兒。」如：「翩翩起舞」。3.往來的樣子。亦作「幡幡」。文選．左思．吳都賦：「其鄰則有任俠之靡，輕訬之客，締交翩翩，儐從弈弈。」4.自得自喜的樣子。文選．張華．鷦鷯賦：「翩翩然，有以自樂也。」5. 形容文采風流的樣子。文選．曹丕．與吳質書：「元瑜書記翩翩，致足樂也。」6.形容舉止灑脫的樣子。初刻拍案驚奇．卷三十四：「在門縫裡窺看，只見聞人生逸致翩翩，有出塵之態。」,,,,,
376,漂搖,漂摇,piào yáo,MOVEMENT,AB,*pʰew *l[a]w,RHYME,鴟 鴞,GuoFeng,風雨所漂搖、予維音嘵嘵。,It is tossed about in the wind and rain: I can but cry out with this note of alarm.,動盪不安、不穩定。反穩定。亦作「飄搖」。,,,,,,
377,平平,平平,píngpíng,EVALUATION,AA,,REDUPLICATION,采 菽,XiaoYa,平平左右、亦是率從。,Discriminating and able are their attendants, Who also have followed them hither.,1. 普通、沒有特別之處。近平淡。後漢書．卷四十七．班超傳：「我以班君當有奇策，今所言平平耳。」2.均等、公平。近平等。元．楊文奎．兒女團圓．楔子：「韓二你要他怎麼？都與這兩個孩兒罷，分的平平兒的也。」,,,,,
379,匍匐,匍匐,púfú,MOVEMENT,AB,*[b]ˤa *[b]ˤək,ALLITERATION,生 民,DaYa,誕實匍匐、克歧克嶷、以就口食。,When he was able to crawl, He looked majestic and intelligent. When he was able to feed himself,,1. 手足伏地爬行。近蒲伏、爬行、膝行。 莊子．秋水：「不聞夫壽陵餘子之學行於邯鄲與？未得國能，又失其故行矣！直匍匐而歸耳。」明．馬中錫．中山狼傳：「先生伏質就地，匍匐以進。」2. 比喻急遽、盡力。詩經．邶風．谷風：「凡民有喪，匍匐救之。」文選．劉琨．答盧諶詩：「裹糧攜弱，匍匐星奔。」,1. Ramper; marcher à quatre pattes; se traîner sur les mains et les pieds. 2. Se jeter à terre; se prosterner; se soumettre. Prosterné. 3. De toutes ses forces. 4. Épuisé; exténué.,,,
378,匍匐,匍匐,púfú,MOVEMENT,AB,*[b]ˤa *[b]ˤək,ALLITERATION,谷 風,GuoFeng,凡民有喪、匍匐救之。,When among others there was a death, I crawled on my knees to help them.,1. 手足伏地爬行。近蒲伏、爬行、膝行。 莊子．秋水：「不聞夫壽陵餘子之學行於邯鄲與？未得國能，又失其故行矣！直匍匐而歸耳。」明．馬中錫．中山狼傳：「先生伏質就地，匍匐以進。」2. 比喻急遽、盡力。詩經．邶風．谷風：「凡民有喪，匍匐救之。」文選．劉琨．答盧諶詩：「裹糧攜弱，匍匐星奔。」,1. Ramper; marcher à quatre pattes; se traîner sur les mains et les pieds. 2. Se jeter à terre; se prosterner; se soumettre. Prosterné. 3. De toutes ses forces. 4. Épuisé; exténué.,,,,
382,祁祁,祁祁,qí qí,MOVEMENT,AA,,REDUPLICATION,韓 奕,DaYa,諸娣從之、祁祁如雲。,The virgins, her companions, followed the lady, Leisurely like a beautiful cloud.,1. 舒緩閒靜的樣子。詩經．召南．采蘩：「被之祁祁，薄言還歸。」文選．班固．東都賦．靈臺詩：「習習祥風，祁祁甘雨。」2.眾多的樣子。詩經．豳風．七月：「春日遲遲，采蘩祁祁。」文選．左思．魏都賦：「有客祁祁，載華載裔。」,,,
380,祁祁,祁祁,qí qí,MOVEMENT,AA,,REDUPLICATION,采 蘩,GuoFeng,被之祁祁、薄言還歸。,In her dead-dress, slowly retiring, She returns to her own apartments.,1. 舒緩閒靜的樣子。詩經．召南．采蘩：「被之祁祁，薄言還歸。」文選．班固．東都賦．靈臺詩：「習習祥風，祁祁甘雨。」2.眾多的樣子。詩經．豳風．七月：「春日遲遲，采蘩祁祁。」文選．左思．魏都賦：「有客祁祁，載華載裔。」,,,,
381,祁祁,祁祁,qí qí,MOVEMENT,AA,,REDUPLICATION,大 田,XiaoYa,有渰萋萋、興雨祁祁。,The clouds form in dense masses, And the rain comes down slowly.,1. 舒緩閒靜的樣子。詩經．召南．采蘩：「被之祁祁，薄言還歸。」文選．班固．東都賦．靈臺詩：「習習祥風，祁祁甘雨。」2.眾多的樣子。詩經．豳風．七月：「春日遲遲，采蘩祁祁。」文選．左思．魏都賦：「有客祁祁，載華載裔。」,,,,,
385,祁祁,祁祁,qí qí,VISUAL,AA,,REDUPLICATION,玄 鳥,ShangSong,四海來假、來假祁祁、景員維河。,From the four seas they come [to out sacrifices]; They come in multitudes; Jing has the He for its outer border.,1. 舒緩閒靜的樣子。詩經．召南．采蘩：「被之祁祁，薄言還歸。」文選．班固．東都賦．靈臺詩：「習習祥風，祁祁甘雨。」2.眾多的樣子。詩經．豳風．七月：「春日遲遲，采蘩祁祁。」文選．左思．魏都賦：「有客祁祁，載華載裔。」,,,,,,
383,祁祁,祁祁,qí qí,VISUAL,AA,,REDUPLICATION,七 月,GuoFeng,春日遲遲、采蘩祁祁。,As the spring days lengthen out, They gather in crowds the white southernwood.,1. 舒緩閒靜的樣子。詩經．召南．采蘩：「被之祁祁，薄言還歸。」文選．班固．東都賦．靈臺詩：「習習祥風，祁祁甘雨。」2.眾多的樣子。詩經．豳風．七月：「春日遲遲，采蘩祁祁。」文選．左思．魏都賦：「有客祁祁，載華載裔。」,,,,,
384,祁祁,祁祁,qí qí,VISUAL,AA,,REDUPLICATION,出 車,XiaoYa,倉庚喈喈、采蘩祁祁。,The oriole's cry comes jie-jie; [Our wives] go in crowds to gather the white southernwood.,1. 舒緩閒靜的樣子。詩經．召南．采蘩：「被之祁祁，薄言還歸。」文選．班固．東都賦．靈臺詩：「習習祥風，祁祁甘雨。」2.眾多的樣子。詩經．豳風．七月：「春日遲遲，采蘩祁祁。」文選．左思．魏都賦：「有客祁祁，載華載裔。」,,,,,,
386,契契,契契,qì qì,FEELING,AA,,REDUPLICATION,大 東,XiaoYa,契契寤歎、哀我憚人。,Sorrowful I awake and sigh; Alas for us toiled people!,憂苦。詩經．小雅．大東：「契契寤歎，哀我憚人。」晉．陶淵明．閑情賦：「改所願而必違，徒契契以苦心。」,Triste; accablé de chagrin.,,,,,
773,戚戚,戚戚,qī qī,EVALUATION,AA,,REDUPLICATION,行 葦,DaYa,戚戚兄弟 。,"Closely related are brethren; Let none be absent, let all be near.",1. 相親。詩經．大雅．行葦：「戚戚兄弟，莫遠具爾。」文選．曹植．求通親表：「退省諸王，常有戚戚具爾之心。」2.憂懼。論語．述而：「君子坦蕩蕩，小人長戚戚。」晉．陶淵明．五柳先生傳：「不戚戚于貧賤，不汲汲于富貴。」3.內心有所感動的樣子。孟子．梁惠王上：「夫子言之，於我心有戚戚焉。」老殘遊記．第二回：「夢湘先生論得透闢極了，於我心有戚戚焉。」,,,,,,
387,僛僛,僛僛,qī qī,MOVEMENT,AA,,REDUPLICATION,賓 之 初 筵,XiaoYa,亂我籩豆、屢舞僛僛。,They disorder the dishes; They keep dancing in a fantastic manner.,形容人姿勢傾斜不能自正。詩經．小雅．賓之初筵：「亂我籩豆，屢舞僛僛。」,,,,,,
388,棲棲,栖栖,qī qī,MOVEMENT,AA,,REDUPLICATION,六 月,XiaoYa,六月棲棲、戎車既飭。,In the sixth month all was bustle and excitement. The war carriages had been made ready,,1. 不安的樣子。論語．憲問：「丘何為是栖栖者與，無乃為佞乎。」晉．陶淵明．和劉柴桑詩：「栖栖世中事，歲月共相疏。」2.孤寂零落的樣子。宋．范成大．潺陵詩：「春草亦已瘦，栖栖晚花少。」3.四處奔走，無暇安居的樣子。詩經．小雅．六月：「六月棲棲，戎車既飭。」抱朴子．外篇．正郭：「而乃自西徂東，席不暇溫，欲慕孔墨棲棲之事。」,,,,,
389,淒淒,凄凄,qī qī,TEMPERATURE,AA,,REDUPLICATION,四 月,XiaoYa,秋日淒淒、百卉具腓。,The autumn days become cold, And the plants all decay.,1. 烏雲密布，即將下雨的樣子。亦作「萋萋」。後漢書．卷六十一．左雄傳：「有渰淒淒，興雨祁祁。」2. 淒涼寒冷的樣子。詩經．小雅．四月：「秋日淒淒，百卉具腓。」3. 悲傷哀痛的樣子。楚辭．屈原．九章．悲回風：「涕泣交而淒淒兮，思不眠以至曙。」4. 水流的樣子。全唐詩．卷八○七．拾得詩：「松拂盤陀石，甘泉涌淒淒。」,1. Froid; frisquet; frais. 2. Triste; mélancolique. 3. Abondant; florissant; prospère. 4. S’égoutter; couler. 5. Humecter; imprégner; mouiller.,,,,
390,淒淒,凄凄,qī qī,TEMPERATURE,AA,,REDUPLICATION,風 雨,GuoFeng,風雨淒淒、雞鳴喈喈。,Cold are the wind and the rain, And shrilly crows the cock.,1. 烏雲密布，即將下雨的樣子。亦作「萋萋」。後漢書．卷六十一．左雄傳：「有渰淒淒，興雨祁祁。」2. 淒涼寒冷的樣子。詩經．小雅．四月：「秋日淒淒，百卉具腓。」3. 悲傷哀痛的樣子。楚辭．屈原．九章．悲回風：「涕泣交而淒淒兮，思不眠以至曙。」4. 水流的樣子。全唐詩．卷八○七．拾得詩：「松拂盤陀石，甘泉涌淒淒。」,1. Froid; frisquet; frais. 2. Triste; mélancolique. 3. Abondant; florissant; prospère. 4. S’égoutter; couler. 5. Humecter; imprégner; mouiller.,,,,
392,萋萋,萋萋,qī qī,VISUAL,AA,,REDUPLICATION,葛 覃,GuoFeng,維葉萋萋、黃鳥于飛。,"Its leaves were luxuriant; The yellow birds flew about,",1. 草茂盛的樣子。唐．崔顥．黃鶴樓詩：「晴川歷歷漢陽樹，春草萋萋鸚鵡洲。」唐．白居易．賦得古原草送別詩：「又送王孫去，萋萋滿別情。」2. 烏雲密布，即將下雨的樣子。亦作「淒淒」。詩經．小雅．大田：「有渰萋萋，興雨祈祈。」,1. Froid; frisquet; frais. 2. Triste; mélancolique. 3. Abondant; florissant; prospère. 4. S’égoutter; couler. 5. Humecter; imprégner; mouiller.,,,,,
393,萋萋,萋萋,qī qī,VISUAL,AA,,REDUPLICATION,出 車,XiaoYa,春日遲遲、卉木萋萋。,The spring-days are lengthening out; The plants and trees grow full of verdure;,1. 草茂盛的樣子。唐．崔顥．黃鶴樓詩：「晴川歷歷漢陽樹，春草萋萋鸚鵡洲。」唐．白居易．賦得古原草送別詩：「又送王孫去，萋萋滿別情。」2. 烏雲密布，即將下雨的樣子。亦作「淒淒」。詩經．小雅．大田：「有渰萋萋，興雨祈祈。」,1. Froid; frisquet; frais. 2. Triste; mélancolique. 3. Abondant; florissant; prospère. 4. S’égoutter; couler. 5. Humecter; imprégner; mouiller.,,,,,
395,萋萋,萋萋,qī qī,VISUAL,AA,,REDUPLICATION,大 田,XiaoYa,有渰萋萋、興雨祁祁。,The clouds form in dense masses, And the rain comes down slowly.,1. 草茂盛的樣子。唐．崔顥．黃鶴樓詩：「晴川歷歷漢陽樹，春草萋萋鸚鵡洲。」唐．白居易．賦得古原草送別詩：「又送王孫去，萋萋滿別情。」2. 烏雲密布，即將下雨的樣子。亦作「淒淒」。詩經．小雅．大田：「有渰萋萋，興雨祈祈。」,1. Froid; frisquet; frais. 2. Triste; mélancolique. 3. Abondant; florissant; prospère. 4. S’égoutter; couler. 5. Humecter; imprégner; mouiller.,,,,
396,萋萋,萋萋,qī qī,VISUAL,AA,,REDUPLICATION,卷 阿,DaYa,菶菶萋萋、雝雝喈喈。,They grow luxuriantly; And harmoniously the notes resound.,1. 草茂盛的樣子。唐．崔顥．黃鶴樓詩：「晴川歷歷漢陽樹，春草萋萋鸚鵡洲。」唐．白居易．賦得古原草送別詩：「又送王孫去，萋萋滿別情。」2. 烏雲密布，即將下雨的樣子。亦作「淒淒」。詩經．小雅．大田：「有渰萋萋，興雨祈祈。」,1. Froid; frisquet; frais. 2. Triste; mélancolique. 3. Abondant; florissant; prospère. 4. S’égoutter; couler. 5. Humecter; imprégner; mouiller.,,,,,
391,萋萋,萋萋,qī qī,VISUAL,AA,,REDUPLICATION,蒹 葭,GuoFeng,蒹葭淒淒、白露未晞。,The reeds and rushes are luxuriant, And the white dew is not yet dry.,1. 草茂盛的樣子。唐．崔顥．黃鶴樓詩：「晴川歷歷漢陽樹，春草萋萋鸚鵡洲。」唐．白居易．賦得古原草送別詩：「又送王孫去，萋萋滿別情。」2. 烏雲密布，即將下雨的樣子。亦作「淒淒」。詩經．小雅．大田：「有渰萋萋，興雨祈祈。」,1. Froid; frisquet; frais. 2. Triste; mélancolique. 3. Abondant; florissant; prospère. 4. S’égoutter; couler. 5. Humecter; imprégner; mouiller.,,,,
394,萋萋,萋萋,qī qī,VISUAL,AA,,REDUPLICATION,杕 杜,XiaoYa,有杕之杜、其葉萋萋。,Solitary stands the russet pear tree, With its leaves so luxuriant.,1. 草茂盛的樣子。唐．崔顥．黃鶴樓詩：「晴川歷歷漢陽樹，春草萋萋鸚鵡洲。」唐．白居易．賦得古原草送別詩：「又送王孫去，萋萋滿別情。」2. 烏雲密布，即將下雨的樣子。亦作「淒淒」。詩經．小雅．大田：「有渰萋萋，興雨祈祈。」,1. Froid; frisquet; frais. 2. Triste; mélancolique. 3. Abondant; florissant; prospère. 4. S’égoutter; couler. 5. Humecter; imprégner; mouiller.,,,,
729,彊彊,强强,qiáng qiáng,VISUAL+EVALUATION,AA,,REDUPLICATION,鶉 之 奔 奔,GuoFeng,鶉之奔奔、鵲之彊彊。,Boldly faithful in their pairings are quails; Vigorously so are magpies.,,,,,,,
730,彊彊,强强,qiáng qiáng,VISUAL+EVALUATION,AA,,REDUPLICATION,鶉 之 奔 奔,GuoFeng,鵲之彊彊、鶉之奔奔。,Vigorously faithful in their pairings are magpies; Boldly so are quails.,,,,,,,
397,蹌蹌,跄跄,qiàng qiàng,EVALUATION,AA,,REDUPLICATION,楚 茨,XiaoYa,濟濟蹌蹌、絜爾牛羊、以往烝嘗。,With correct and reverent deportment,  The oxen and sheep all pure,  We proceed to the winter and autumnal sacrifices.,1. 行步威儀的樣子。詩經．大雅．公劉：「蹌蹌濟濟，俾筵俾几。」2.飛舞、跳舞的樣子。書經．益稷：「笙鏞以間，鳥獸蹌蹌。」3.行走的樣子。文選．揚雄．羽獵賦：「啾啾蹌蹌，入西園，切神光。」,,,,
398,蹌蹌,跄跄,qiàng qiàng,MOVEMENT,AA,,REDUPLICATION,公 劉,DaYa,蹌蹌濟濟、俾筵俾几。,"With his officers all in dignified order, He caused mats to be spread, with stools upon them;",1. 行步威儀的樣子。詩經．大雅．公劉：「蹌蹌濟濟，俾筵俾几。」2.飛舞、跳舞的樣子。書經．益稷：「笙鏞以間，鳥獸蹌蹌。」3.行走的樣子。文選．揚雄．羽獵賦：「啾啾蹌蹌，入西園，切神光。」,,,,,,
400,鏘鏘,锵锵,qiāng qiāng,SOUND,AA,,REDUPLICATION,韓 奕,DaYa,百兩彭彭、八鸞鏘鏘、不顯其光。,"His hundred chariots were in grand array, The eight bells of each emitting their tinkling; Illustrious was the glory [of the occasion].",1. 狀聲詞：(a)​ 形容玉石撞擊聲。三國演義．第四十四回：「衣冠濟濟，劍佩鏘鏘，分班侍立。」(b)​ 形容鈴聲。詩經．大雅．韓奕：「百兩彭彭，八鸞鏘鏘。」漢．秦嘉．贈婦詩三首之三：「肅肅僕夫征，鏘鏘揚和鈴。」(c)​ 形容鳳凰和鳴聲。左傳．莊公二十二年：「鳳凰于飛，和鳴鏘鏘。」2. 高聳巍峨的樣子。後漢書．卷五十九．張衡傳：「命琅掌策駟兮，踰高閣之鏘鏘。」3. 行走的樣子。或作「蹡蹡」。文選．左思．吳都賦：「出車檻檻，被練鏘鏘。」,1. Onomat. imitant le tintement de clochettes ou les cris du phénix. 2. Haut; élevé. 3. Abondant; riche.,,,,,
401,瑲瑲,玱玱,qiāng qiāng,SOUND,AA,,REDUPLICATION,采 芑,XiaoYa,方叔率止、約軝錯衡、八鸞瑲瑲。,Fang Shu led them on, The naves of his wheels bound with leather, and his yoke ornamented. Tinkle-tinkle went the eight bells at the horses' bits.,玉相击的声音。,Onomat. imitant le tintement d’une sonnette.,,,
399,鏘鏘,锵锵,qiāng qiāng,SOUND,AA,,REDUPLICATION,烝 民,DaYa,四牡彭彭、八鸞鏘鏘。,His steeds went on without stopping, To the tinkling of their eight bells.,1. 狀聲詞：(a)​ 形容玉石撞擊聲。三國演義．第四十四回：「衣冠濟濟，劍佩鏘鏘，分班侍立。」(b)​ 形容鈴聲。詩經．大雅．韓奕：「百兩彭彭，八鸞鏘鏘。」漢．秦嘉．贈婦詩三首之三：「肅肅僕夫征，鏘鏘揚和鈴。」(c)​ 形容鳳凰和鳴聲。左傳．莊公二十二年：「鳳凰于飛，和鳴鏘鏘。」2. 高聳巍峨的樣子。後漢書．卷五十九．張衡傳：「命琅掌策駟兮，踰高閣之鏘鏘。」3. 行走的樣子。或作「蹡蹡」。文選．左思．吳都賦：「出車檻檻，被練鏘鏘。」,1. Onomat. imitant le tintement de clochettes ou les cris du phénix. 2. Haut; élevé. 3. Abondant; riche.,,,,
402,繾綣,缱绻,qiǎnquǎn,EVALUATION,AB,*[k]ʰe[n] *[g]ʷren,RHYME,民 勞,DaYa,無縱詭隨、以謹繾綣。,Let us give no indulgence to the wily and obsequious, In order to make the parasites careful,,情意纏綿不忍分離的樣子。唐．元稹．會真詩三十韻：「留連時有限，繾綣意難終。」二刻拍案驚奇．卷十七：「兩個解衣就枕，魚水歡情，極其繾綣。」,1. Étroitement attaché à; profondément affectionné. Affection mutuelle. 2. Compagnon; intime. 3. Parasites (qui vivent au crochet des autres).,,,
403,譙譙,谯谯,qiáo qiáo,VISUAL,AA,,REDUPLICATION,鴟 鴞,GuoFeng,予羽譙譙、予尾翛翛、,My wings are all-injured; My tail is all-broken;,羽毛散亂殘敝的樣子。詩經．豳風．鴟鴞：「予羽譙譙，予尾脩脩。」,,,,,,
404,翹翹,翘翘,qiào qiào,VISUAL,AA,,REDUPLICATION,漢 廣,GuoFeng,翹翹錯薪、言刈其楚。,Many are the bundles of firewood; I would cut down the thorns [to form more].,1. 高而錯雜。詩經．周南．漢廣：「翹翹錯薪，言刈其楚。」2.危險。詩經．豳風．鴟鴞：「予室翹翹，風雨所漂搖。」3. 遠。左傳．莊公二十二年：「翹翹車乘，招我以弓。」4. 出群。文選．潘岳．關中詩：「翹翹趙王，請徒三萬。」,,,,,,
405,翹翹,翘翘,qiào qiào,VISUAL,AA,,REDUPLICATION,漢 廣,GuoFeng,翹翹錯薪、言刈其蔞 。,Many are the bundles of firewood; I would cut down the southern wood [to form more].,1. 高而錯雜。詩經．周南．漢廣：「翹翹錯薪，言刈其楚。」2.危險。詩經．豳風．鴟鴞：「予室翹翹，風雨所漂搖。」3. 遠。左傳．莊公二十二年：「翹翹車乘，招我以弓。」4. 出群。文選．潘岳．關中詩：「翹翹趙王，請徒三萬。」,,,,,,
406,翹翹,翘翘,qiào qiào,VISUAL,AA,,REDUPLICATION,鴟 鴞 ,GuoFeng,予尾翛翛、予室翹翹、,My tail is all-broken; My house is in a perilous condition;,1. 高而錯雜。詩經．周南．漢廣：「翹翹錯薪，言刈其楚。」2.危險。詩經．豳風．鴟鴞：「予室翹翹，風雨所漂搖。」3. 遠。左傳．莊公二十二年：「翹翹車乘，招我以弓。」4. 出群。文選．潘岳．關中詩：「翹翹趙王，請徒三萬。」,,,,,,
408,悄悄,悄悄,qiāoqiāo,FEELING,AA,,REDUPLICATION,出 車,XiaoYa,憂心悄悄、僕夫況瘁。,he [general's] heart was anxious and sad, And the carriage-officers appeared full of care.,1. 憂愁的樣子。近悄然。詩經．邶風．柏舟：「憂心悄悄，慍于群小。」2.寂靜的樣子。唐．白居易．西樓夜詩：「悄悄復悄悄，城隅隱林杪。」近默默、寂靜、靜靜。3.不聲不響。儒林外史．第三十五回：「莊徵君悄悄寫了十幾封書子，打發人進京去遍託朝裡大老。」,,,,,
407,悄悄,悄悄,qiāoqiāo,FEELING,AA,,REDUPLICATION,柏 舟,GuoFeng,憂心悄悄、慍于群小。,My anxious heart is full of trouble; I am hated by the herd of mean creatures;,1. 憂愁的樣子。近悄然。詩經．邶風．柏舟：「憂心悄悄，慍于群小。」2.寂靜的樣子。唐．白居易．西樓夜詩：「悄悄復悄悄，城隅隱林杪。」近默默、寂靜、靜靜。3.不聲不響。儒林外史．第三十五回：「莊徵君悄悄寫了十幾封書子，打發人進京去遍託朝裡大老。」,,,,,,
409,契闊,契阔,qiè kuò,VISUAL,AB,*[kʰ]ˤet-s *[k]ʰˤot,PARARHYME,擊 鼓,GuoFeng,死生契闊、與子成說。,For life or for death, however separated, To our wives we pledged our word.,1. 勤苦。文選．韋曜．博弈論：「勞神苦體，契闊勤思。」2. 分離，相隔。詩經．邶風．擊鼓：「死生契闊，與子成說。」朱熹．集傳：「契闊，隔遠之意。」唐．薛調．無雙傳：「噫！人生之契闊會合多矣，罕有若斯之比。」3. 久別的情懷。後漢書．卷八十一．獨行傳．范冉傳：「行路急卒，非陳契闊之所，可共到前亭宿息，以敘分隔。」,,,,
410,欽欽,钦钦,qīn qīn,FEELING,AA,,REDUPLICATION,晨 風,GuoFeng,未見君子、憂心欽欽。,While I do not see my husband, My heart cannot forget its grief.,,1. Plein de sollicitude. 2. Prudent et sur ses gardes. 3. Entreprenant; avide de progrès. 4. Souffler en ouvrant la bouche. 5. Tintement de cloches régulier (selon certaines règles).,,,,
