arthur,thomas,traditional,simplified,radsup,morphology,MC,OC,variant,Kroll,zdic,note,id
you2~yan3,yóu~yǎn,游衍,游衍,水,NA,yuw~yenX,*[N-]ru~*N-q(r)anʔ,NA,NA,恣意縱遊。詩經．大雅．板：「昊天曰旦，及爾游衍。」唐．王維．桃源行：「出洞無論隔山水，辭家終擬長游衍。」,NA,1965
miao3~ran2,miǎo~rán,渺然,渺然,水,NA,mjiewX~nyen,*[m]ewʔ~*[n]a[n],NA,NA,悠遠。唐．趙嘏．江樓感舊詩：「獨上江樓思渺然，月光如水水如天。」,NA,1031
hun4~hun4,hùn~hùn,渾渾,浑浑,水,NA,hwonH-hwonH,*[g]ˤ[u]r~*[g]ˤ[u]r,NA,NA,水流暢盛的樣子。荀子．富國：「下得地利，中得人和，則財貨渾渾如泉源。」昏昧無知的樣子。北周．庾信．小園賦：「諒天造兮昧昧，嗟生民兮渾渾。」純樸。漢．揚雄．法言．問神：「虞夏之書渾渾爾，商書灝灝爾。」大的樣子。唐．韓愈．進學解：「上規姚姒，渾渾無涯，周誥殷盤，佶屈聱牙。」紛亂的樣子。素問．卷十．瘧論：「無刺渾渾之脈，無刺漉漉之汗。」,NA,546
wen1~wen1,wēn~wēn,溫溫,温温,水,NA,'won~’won,NA~NA,NA,NA,NA,NA,1581
zhen1~zhen1,zhēn~zhēn,溱溱,溱溱,水,NA,tsrin~tsrin,NA~NA,NA,NA,眾多、茂盛。詩經．小雅．無羊：「旐維旟矣，室家溱溱。」後漢書．卷四十．班彪傳下：「百穀溱溱，庶卉蕃蕪。」微微出汗的樣子。黃帝素問靈樞經．卷六．決氣：「腠理發泄，汗出溱溱，是謂津。」舒發開展的樣子。漢．揚雄．太玄經．卷二．進：「陽引而進，物出溱溱，開明而前。」,NA,2046
di1~li4,dī~lì,滴瀝,滴沥,水,NA,tek-lek,NA~NA,NA,dribbling droplets,狀聲詞。形容水滴落下的聲音。文選．王延壽．魯靈光殿賦：「動滴瀝以成響，殷雷應其若驚。」,also 瀝滴,281
you1~you1,yōu~yōu,滺滺,滺滺,水,NA,yuw~yuw,NA~NA,NA,NA,NA,NA,1957
piao1~yao2,piāo~yáo,漂搖,漂摇,NA,NA,phjew~yew,NA~*law,NA,NA,NA,NA,1172
piao1~piao1,piāo~piāo,漂漂,漂漂,水,NA,phjew~phjew,NA~NA,NA,NA,高飛的樣子。文選．賈誼．弔屈原文：「鳳漂漂其高逝兮，固自引而遠去。」漂浮流去。呂氏春秋．慎行論．求人：「沸水漂漂，九陽之山。」唐．杜甫．嚴氏溪放歌行：「天下甲馬未盡銷，豈免溝壑常漂漂。」,NA,1166
yan3~yang4,yǎn~yàng,演漾,演漾,水,NA,yenX~NA,*N-q(r)anʔ~NA,NA,NA,NA,NA,1773
mo4~mo4,mò~mò,漠漠,漠漠,水,NA,mak~mak,NA~NA,NA,NA,寂靜無聲。宋．秦觀．浣溪沙．漠漠輕寒詞：「漠漠輕寒上小樓，曉陰無賴似窮秋。」宋．蘇軾．漁父．漁父笑詞：「漁父笑，輕鷗舉，漠漠一家風雨。」密布羅列的樣子。唐．王維．積雨輞川莊作詩：「漠漠水田飛白鷺，陰陰夏木囀黃鸝。」唐．韋應物．賦得暮雨送李曹詩：「漠漠帆來重，冥冥鳥來遲。」分散布列的樣子。南朝齊．謝朓．游東田詩：「遠樹曖阡阡，生煙紛漠漠。」宋．陸游．病起詩：「斷香漠漠便支枕，芳草離離悔倚闌。」昏暗的樣子。唐．杜甫．秋日夔府詠懷奉寄鄭監李賓客一百韻詩：「兵戈塵漠漠，江漢月娟娟。」,NA,1055
lian2~lian2,lián~lián,漣漣,涟涟,水,NA,ljen~ljen,*[r]a[n]~*[r]a[n],NA,NA,哭泣流淚的樣子。詩經．衛風．氓：「不見復關，泣涕漣漣。既見復關，載笑載言。」,NA,826
jian4~jian4,jiàn~jiàn,漸漸,渐渐,水,NA,tsjem~tsjem,*[ts]am~*[ts]am,NA,NA,逐漸。儒林外史．第一回：「那黑雲邊上鑲著白雲，漸漸散去，透出一派日光來，照耀得滿湖通紅。」紅樓夢．第一回：「彼時雖有軍民來救，那火已成了勢，如何救得下？直燒了一夜方漸漸的熄去，也不知燒了幾家。」近慢慢、逐步、逐漸亦作「漸次」。,NA,595
yang4~yang4,yàng~yàng,漾漾,漾漾,水,NA,yangX~yangX,NA~NA,NA,NA,搖動的樣子。唐．王維．青谿詩：「漾漾泛菱荇，澄澄映葭葦。」唐．溫庭筠．太液池歌：「腥鮮龍氣連清防，花風漾漾吹細光。」,NA,1802
xi1~xi1,xī~xī,潝潝,潝潝,水,NA,xip~xip,NA~NA,NA,NA,朋比為奸，眾口附和的樣子。詩經．小雅．小旻：「潝潝訿訿，亦孔之哀。」亦作「翕翕」、「歙歙」。,id 701-703,1619
kui4~kui4,kuì~kuì,潰潰,溃溃,水,NA,hwojH~hwojH,*[gʷ]ˤ[ə]j-s~*[gʷ]ˤ[ə]j-s,NA,NA,擾亂的樣子。詩經．大雅．召旻：「昏椓靡共，潰潰回遹。」,NA,768
cheng2~cheng2,chéng~chéng,澄澄,澄澄,水,NA,dring~dring,*[d]rəŋ~*[d]rəŋ,NA,NA,NA,NA,182
ze2~ze2,zé~zé,澤澤,泽泽,NA,NA,draek~draek,*lˤrak~*lˤrak,NA,NA,NA,NA,2022
dan4~dan4,dàn~dàn,澹澹,澹澹,水,NA,damX~damX,*[l]ˤamʔ~*[l]ˤamʔ,NA,NA,水搖蕩的樣子。漢．曹操．觀滄海詩：「水何澹澹，山島竦峙。」唐．李白．夢遊天姥吟留別詩：「雲青青兮欲雨，水澹澹兮生煙。」恬靜的樣子。元．趙孟頫．虞美人．潮生潮落詞：「消沉萬古意無窮，盡在長空澹澹鳥飛中。」,NA,261
dan4~ran2,dàn~rán,澹然,澹然,水,NA,damX~nyen,*[l]ˤamʔ~*[n]a[n],NA,NA,恬靜的樣子。文選．揚雄．長楊賦：「使海內澹然，永亡邊城之災、兵革之患。」唐．柳宗元．晨詣超師院讀禪經詩：「澹然離言說，悟悅心自足。」水波搖動的樣子。唐．溫庭筠．利州南渡詩：「澹然空水帶斜暉，曲島蒼茫接翠微。」,NA,267
ji1~ji1,jī~jī,激激,激激,水,NA,kek~kek,*[k]ˤewk~*[k]ˤewk,NA,NA,水勢湍急的樣子。宋．蘇軾．和王蘇州侍太夫人觀燈詩二首之二：「翻翻緹騎走香塵，激激飛濤射火輪。」狀聲詞。形容急流的聲音。唐．韓愈．山石詩：「當流赤足蹋澗石，水聲激激風吹衣。」清澈、清澄。漢．無名氏．戰城南詩：「水深激激，蒲葦冥冥。」,NA,558
nong2~nong2,nóng~nóng,濃濃,浓浓,水,NA,nrjowng~nrjowng,*n<r>oŋ~*n<r>oŋ,NA,NA,濃厚、盛多的樣子。詩經．小雅．蓼蕭：「蓼彼蕭斯，零露濃濃。」如：「濃濃情意」。反淡淡,NA,1083
hui4~hui4,huì~huì,濊濊,濊濊,水,NA,xwat~xwat,*qʷʰˤat~*qʷʰˤat,NA,NA,魚網投入水中的聲音。詩經．魏風．碩人：「施罛濊濊，鱣鮪發發。」宋．蘇軾．戲作放魚詩：「濊濊發發須臾間，圉圉洋洋尋丈外。」,NA,539
ji3~ji3,jǐ~jǐ,濟濟,济济,水,NA,tsejX~tsejX,*[ts]ˤ[i]jʔ~*[ts]ˤ[i]jʔ,NA,NA,形容人多，陣容盛大。詩經．大雅．文王：「濟濟多士，文王以寧。」整齊雄美，有威儀的樣子。荀子．大略：「朝廷之美，濟濟鎗鎗。」文選．左思．詠史詩八首之四：「濟濟京城內，赫赫王侯居。」,NA,575
ru2~ran3,rú~rǎn,濡染,濡染,水,NA,nyu~nyemX,*no~*C.n[a]mʔ,NA,NA,感染、參雜。宋．蘇籀．遺言：「公言近世學問，濡染陳俗卻人，雖善士亦或不免。」近沾染溼潤。常指提筆寫字作畫。唐．李商隱．韓碑詩：「公退齋戒坐小閣，濡染大筆何淋漓。」明．高濂．玉簪記．第十齣：「（外）​仙姑手中佳扇，為何無人題寫？（旦）​欲求足下濡染，未敢輕凟。」,NA,1350
yan2~yan2,yán~yán,炎炎,炎炎,火,NA,hjem~hjem,*[ɢ]ʷ(r)am~*[ɢ]ʷ(r)am,NA,NA,很熱的樣子。如：「夏日炎炎」。熱氣很盛的樣子。詩經．大雅．雲漢：「赫赫炎炎，云我無所。」紅樓夢．第一回「只見烈日炎炎，芭蕉冉冉，夢中之事便忘了對半。」火光猛烈的樣子。史記．卷二十七．天官書：「炎炎有光，偃兵。」清．金俞邁．詠木棉事詩：「鋤花偏喜日卓午，曦馭炎炎似火輪。」權勢顯赫的樣子。文選．揚雄．解嘲：「炎炎者滅，隆隆者絕。」,NA,1767
zheng1~zheng1,zhēng~zhēng,烝烝,烝烝,火,NA,tsying~tsying,*təŋ~*təŋ,NA,NA,興盛的樣子。如：「草木烝烝，日以繁茂。」德業淳厚的樣子。書經．堯典：「克諧以孝烝烝，乂不格姦。」史記．卷一二二．酷吏傳．序：「網漏於吞舟之魚，而吏治烝烝，不至於姦，黎民艾安。」,NA,2059
yan4~yan4,yàn~yàn,焱焱,焱焱,火,NA,yemH~yemH,NA~NA,NA,"flaming, blazing, like flickering flames, shimmering sparks",NA,NA,1782
he4~he4,hè~hè,熇熇,熇熇,火,NA,howk~howk,NA~NA,NA,NA,火勢熾盛的樣子，多指慘毒的惡政。詩經．大雅．板：「多將熇熇，不可救藥。」興旺的樣子。明．劉基．靈丘丈人：「是何昔者之熇熇，而今日之涼涼也。」,NA,460
xun1~xun1,xūn~xūn,熏熏,熏熏,火,NA,xjun~xjun,*qʰu[n]~*qʰu[n],NA,NA,和悅的樣子。詩經．大雅．鳧鷖：「鳥鷖在亹，公尸來止熏熏。」文選．張衡．東京賦：「君臣歡康，具醉熏熏。」眾多的樣子。漢．揚雄．太玄經．卷二．交：「往來熏熏，得亡之門。」,NA,1752
ying2~ying2,yíng~yíng,熒熒,荧荧,火,NA,hweng~hweng,*[N]-qʷˤeŋ~*[N]-qʷˤeŋ,NA,NA,光豔的樣子。史記．卷四十三．趙世家：「美人熒熒兮，顏若苕之榮。」文選．宋玉．高唐賦：「玄木冬榮，煌煌熒熒。」閃動的樣子。漢．秦嘉．贈婦詩：「飄飄帷帳，熒熒華燭。」唐．杜牧．阿房宮賦：「明星熒熒，開妝鏡也。」微弱的樣子。明．歸有光．先妣事略：「孺人之吳家橋，則治木綿，入則，則緝纑，燈火熒熒，每至夜分。」,l,1938
xi1~xi1,xī~xī,熙熙,熙熙,火,NA,xi~xi,*qʰ(r)ə~*qʰ(r)ə,NA,NA,和樂的樣子。老子．第二十章：「眾人熙熙，如享太牢。」唐．韋應物．往富平傷懷詩：「出門無所憂，返室亦熙熙。」形容笑聲。太平廣記．卷四一九．柳毅傳：「紅妝千萬，笑聲熙熙。」,NA,1620
lin2~lin2,lín~lín,燐燐,燐燐,火,NA,lin~lin,NA~NA,NA,NA,清晰可見的樣子。文選．劉楨．贈從弟詩三首之一：「汎汎東流水，磷磷水中石。」,NA,872
yan4~yan4,yàn~yàn,燕燕,燕燕,火,NA,'enH~'enH,*ʔˤe[n]-s~*ʔˤe[n]-s,NA,NA,燕子。詩經．邶風．燕燕：「燕燕于飛，差池其羽。」唐．齊己．新燕詩：「燕燕知何事，年年應候來。」比喻妻妾或美女。宋．蘇軾．張子野年八十五尚聞買妾述古令作詩：「詩人老去鶯鶯在，公子歸來燕燕忙。」如：「鶯鶯燕燕」。悠閒的樣子。詩經．小雅．北山：「或燕燕居息，或盡瘁事國。」毛亨．傳：「燕燕，安息貌。」亦作「宴宴」。,"note! yan~yan is an ideophone but not always, sometimes as 'swallow' it is distributive",1780
yao4~yao4,yào~yào,燿燿,燿燿,火,NA,yewH~yewH,*lewk-s~*lewk-s,NA,NA,光明的樣子。文選．司馬相如．長門賦：「五色炫以相曜兮，爛耀耀而成光。」,NA,1831
ye4~ye4,yè~yè,爗爗,爗爗,火,NA,hip~hip,*ɢʷ(r)[ə]p~*ɢʷ(r)[ə]p,NA,NA,NA,NA,1838
yi1~jie1,yī~jiē,猗嗟,猗嗟,NA,NA,'i~tsjae,NA~*tsAj,NA,NA,表示讚嘆的語詞。詩經．齊風．猗嗟：「猗嗟昌兮，頎而長兮。」毛亨．傳：「猗嗟，歎辭。」唐．張說．大唐中散大夫行淄州司馬鄭府君神道碑：「猗嗟君子，世濟其美。」詩經齊風的篇名。共三章。根據詩序：「猗嗟，刺魯莊公也。」首章二句為：「猗嗟昌兮，頎而長兮。」猗嗟，嘆詞。,NA,1844
yi1~yu3,yī~yǔ,猗歟,猗欤,NA,NA,'je~yo,NA~NA,NA,ah yes! oh indeed!,NA,NA,1852
yi1~yu3,yī~yǔ,猗與,猗与,NA,NA,‘jeX~yoX,NA~*m-q(r)aʔ,NA,NA,NA,NA,1851
qiang1~qiang1,qiāng~qiāng,瑲瑲,瑲瑲,玉,NA,tshjang~tshjang,NA~NA,NA,NA,NA,NA,1257
fu3~fu3,fǔ~fǔ,甫甫,甫甫,NA,NA,pjuX~pjuX,*p(r)aʔ~*p(r)aʔ,NA,NA,NA,NA,396
tian2~tian2,tián~tián,田田,田田,田,NA,den~den,*lˤiŋ~*lˤiŋ,NA,NA,荷葉鮮碧的樣子。漢．無名氏．江南詩：「江南可採蓮，蓮葉何田田。」宋．歐陽修．漁家傲．荷葉田田青照水詞：「荷葉田田青照水，孤舟挽在花陰底。」,NA,1494
shen1~shen1,shēn~shēn,申申,申申,申,NA,syin~syin,*l̥i[n]~*l̥i[n],NA,NA,怡然自得的樣子。論語．述而：「子之燕居，申申如也。」重複。楚辭．屈原．離騷：「女嬃之蟬媛兮，申申其詈予。」嚴整的樣子。漢書．卷二十二．禮樂志：「敕身齊戒，施教申申。」,NA,1383
guan3~guan3,guǎn~guǎn,痯痯,痯痯,疒,NA,kwanX~kwanX,*kʷˤa[n]ʔ~*kʷˤa[n]ʔ,NA,NA,NA,NA,426
deng1~deng1,dēng~dēng,登登,登登,癶,NA,tong~tong,*k-tˤəŋ~*k-tˤəŋ,NA,NA,狀聲詞：(1)​ 形容築牆用力相應的聲音。詩經．大雅．綿：「築之登登，削屢馮馮。」(2)​ 形容打碑的聲音。宋．蘇軾．孫莘老求墨妙亭詩：「龜趺入座螭隱壁、空齋晝靜聞登登。」,NA,278
fa1~fa1,fā~fā,發發,发发,癶,NA,pjot~pjot,*Cə.pat~*Cə.pat,NA,NA,風吹強烈、急速的樣子。詩經．小雅．蓼莪：「南山烈烈，飄風發發。」亦作「弗弗」。,alt pron  bō bō,338
bai2~bai2,bái~bái,白白,白白,白,NA,baek~baek,*bˤrak~*bˤrak,NA,NA,平白無故的。京本通俗小說．志誠張主管：「王招宣初娶時，十分寵幸；後來只為一句話破綻些，失了主人之心，情愿白白裡把與人。」紅樓夢．第六十九回：「你還依我，將此劍斬了那妒婦，一同歸至警幻案下，聽其發落。不然，你則白白的喪命，且無人憐惜。」如：「白白挨罵。」無可奈何的。老殘遊記．第一回：「章伯一想，理路卻也不錯，便道：『依你該怎麼樣？難道白白地看他們死嗎？』」勞而無獲的。初刻拍案驚奇．卷二十九：「等了多時，並不見牆裡有些些聲響，……到第二晚、第三晚，又復如此。白白守了三個深夜，並無動靜。」毫無牽掛的。紅樓夢．第四回：「雨村聽了，大怒道：『豈有這樣放屁的事！打死人命，竟白白走了，再拿不來的。』」,NA,40
jiao3~jiao3,jiǎo~jiǎo,皎皎,皎皎,白,NA,kjewX~kjewX,NA~NA,NA,NA,潔白的樣子。詩經．小雅．白駒：「皎皎白駒，食我場苗。」文選．何晏．景福殿賦：「皎皎白間，離離列錢。」近潔白、皎白、皎潔光明的樣子。文選．古詩十九首．明月何皎皎：「明月何皎皎，照我羅床幃。」文選．孔稚珪．北山移文：「其亭亭物表，皎皎霞外。」近皎潔,NA,614
gao1~gao1,gāo~gāo,皐皐,皐皐,白,NA,kaw~kaw,NA~NA,NA,NA,NA,NA,402
hao4~hao4,hào~hào,皓皓,皓皓,白,NA,hawX~hawX,NA~NA,NA,NA,潔白的樣子。詩經．唐風．揚之水：「揚之水，白石皓皓。」曠達的樣子。大戴禮記．衛將軍文子：「常以皓皓，是以眉壽，是曾參之行也。」廣大的樣子。史記．卷二十九．河渠書：「瓠子決兮將奈何？皓皓旰旰兮閭殫為河！」光明的樣子。漢．揚雄．法言．淵騫：「明星皓皓，華藻之力也與。」,NA,457
jiao3~jiao3,jiǎo~jiǎo,皦皦,皦皦,白,NA,kjewX~kjewX,NA~NA,NA,NA,潔白明淨的樣子。後漢書．卷六十一．黃瓊傳：「嶢嶢者易缺，皦皦者易汙。」文選．左思．雜詩：「明月出雲崖，皦皦流素光。」心胸光明。如：「心中皦皦」。,NA,615
pan2~pan2,pán~pán,盤盤,盘盘,皿,NA,ban~ban,*[b]ˤan~*[b]ˤan,NA,NA,形容迴旋曲折的樣子。唐．李白．蜀道難：「青泥何盤盤，百步九折縈巖巒。」形容盛大的樣子。南朝宋．檀道鸞．續晉陽秋．郄超：「大才槃槃謝家安，江東獨步王文度，盛德日新郄嘉賓。」,NA,1102
dang4~dang4,dàng~dàng,盪盪,盪盪,皿,NA,dangX~dangX,NA~NA,NA,NA,NA,NA,271
qiong2~qiong2,qióng~qióng,睘睘,睘睘,罒,NA,hwaen~hwaen,*[ɢ]ʷˤ<r>en~*[ɢ]ʷˤ<r>en,NA,NA,NA,rad. is 罒 or 目,1297
juan4~juan4,juàn~juàn,睠睠,睠睠,目,NA,kjwenH~kjwenH,*[k]ro[n]-s~*[k]ro[n]-s,NA,NA,NA,NA,694
chu4~chu4,chù~chù,矗矗,矗矗,直,NA,tsrhjuwk~tsrhjuwk,NA~NA,NA,NA,高聳的樣子。文選．司馬相如．上林賦：「崇山矗矗，巃嵸崔巍。」明史．卷三二五．外國傳六．浡泥傳：「矗矗高山，以鎮王國。」層層疊起的樣子。宋．梅堯臣．依韻和孫都官河上寫望詩：「魚腥矗矗橋邊市，花暗深深竹裡窗。」,NA,207
jin1~jin1,jīn~jīn,矜矜,矜矜,NA,NA,king~king,"*k-riŋ (dialect: *k-r- > k-, *-iŋ > MC -ing)~*k-riŋ (dialect: *k-r- > k-, *-iŋ > MC -ing)",NA,NA,堅強的樣子。詩經．小雅．無羊：「矜矜兢兢，不騫不崩。」形容戒慎危懼的樣子。後漢書．卷三十下．郎顗傳：「豈可不剛健篤實，矜矜慄慄，以守天功盛德大業乎？」三國志．卷二十五．魏書．高堂隆傳：「畏上天之明命，循陰陽之逆順，矜矜業業，惟恐有違。」,NA,644
lu4~lu4,lù~lù,碌碌,碌碌,石,NA,luwk~luwk,NA~NA,NA,"rough and unworked (of stones or gems); also, crude and common, banal and ordinary; (med.) also, onom. of grumble and groan of cart-wheels, creak and rattle",平庸的樣子。後漢書．卷八十．文苑傳下．禰衡傳：「餘子碌碌，莫足數也。」三國演義．第二十一回：「此等碌碌小人，何足挂齒。」或作「逯逯」、「錄錄」、「陸陸」。忙碌、奔波。紅樓夢．第二十二回：「從前碌碌卻因何？到如今，回頭試想真無趣。」狀聲詞。形容車行的聲音。唐．賈島．古意詩：「碌碌復碌碌，百年雙轉轂。」亦作「轆轆」。形容玉石的色彩美麗。南朝梁．劉勰．文心雕龍．總術：「落落之玉，或亂乎石；碌碌之石，時似乎玉。」才氣洋溢。南朝宋．劉義慶．世說新語．識鑒：「唯阿奴碌碌，當在阿母目下耳。」,NA,942
qing4~kong4,qìng~kòng,磬控,磬控,NA,NA,khengH~khuwngH,*[C.qʰ]ˤeŋ-s~*kʰˤoŋ-s,NA,NA,不讓馬前進的馭馬方法。詩經．鄭風．大叔于田：「抑磬控忌，抑縱送忌。」,NA,1292
zhi4~zhi4,zhì~zhì,秩秩,秩秩,禾,NA,drjit~drjit,NA~NA,NA,NA,清明的樣子。詩經．大雅．假樂：「威儀抑抑，德音秩秩。」肅敬的樣子。詩經．小雅．賓之初筵：「賓之初筵，左右秩秩。」水流的樣子。詩經．小雅．斯干：「秩秩斯干，幽幽南山。」有順序的樣子。荀子．仲尼：「貴賤長少，秩秩焉。」,NA,2071
shao1~shao1,shāo~shāo,稍稍,稍稍,禾,NA,sraewH~sraewH,*[s](ˤ)rew-s~*[s](ˤ)rew-s,NA,NA,約略、稍微。如：「他最近稍稍胖了一點。」漸漸。戰國策．齊策四：「由此觀之，非得失之策與？稍稍誅滅，滅亡無族之時，欲為監門閭里，安可得而有乎哉？」史記．卷七十六．平原君虞卿傳：「賓客門下舍人，稍稍引去者過半。」,NA,1377
mu4~mu4,mù~mù,穆穆,穆穆,禾,NA,mjuwk~mjuwk,*m(r)iwk~*m(r)iwk,NA,NA,美好。詩經．大雅．文王：「穆穆文王，於緝熙敬止。」威儀盛大的樣子。禮記．曲禮下：「天子穆穆，諸侯皇皇，大夫濟濟，士蹌蹌，庶人僬僬。」深遠的樣子。如：「神思穆穆」。平和恭敬的樣子。書經．呂刑：「穆穆在上，明明在下，灼于四方，罔不惟德之勤。」柔和。漢．無名氏．穆穆清風至詩：「穆穆清風至，吹我羅衣裙。」,NA,1060
sui4~sui4,suì~suì,穟穟,穟穟,禾,NA,zwijH~zwijH,*s.[ɢ]ʷi[t]-s~*s.[ɢ]ʷi[t]-s,NA,NA,禾苗茂盛美好的樣子。詩經．大雅．生民：「禾役穟穟，麻麥幪幪。」,NA,1427
rang2~rang2,ráng~ráng,穰穰,穰穰,禾,NA,nyang~nyang,NA~NA,NA,NA,豐盛繁多的樣子。詩經．周頌．執競：「降福穰穰，降福簡簡。」史記．卷一二六．滑稽傳．淳于髡傳：「五穀蕃熟，穰穰滿家。」眾多的樣子。紛亂的樣子。,NA,1332
jiu1~jiu1,jiū~jiū,究究,究究,穴,NA,kjuwH~kjuwH,*[k](r)u(ʔ)-s~*[k](r)u(ʔ)-s,NA,NA,憎惡而不相親近的樣子。詩經．唐風．羔裘：「羔裘豹褎，自我人究究。」不停的樣子。楚辭．劉向．九歎．遠逝：「遭傾遇禍不可救兮，長吟永欷涕究究兮。」,NA,664
kong1~kong1,kōng~kōng,空空,空空,穴,NA,khuwng~khuwng,*kʰˤoŋ~*kʰˤoŋ,NA,NA,虛心誠懇的樣子。後漢書．卷四十三．何敞傳：「上當匡正綱紀，下當濟安元元，豈但空空無違而已哉！」淳樸誠實的樣子。呂氏春秋．慎大覽．下賢：「悤悤乎其心之堅固也，空空乎其不為巧故也。」佛教用語。指空的概念也是沒有實性。大智度論．卷三十一：「是故以空捨空，是名『空空』。」,NA,736
guan3~guan3,guǎn~guǎn,管管,管管,竹,NA,kwanX~kwanX,*[k]ˤo[n]ʔ~*[k]ˤo[n]ʔ,NA,NA,沒有依靠。詩經．大雅．板：「靡聖管管，不實於亶。」形容見識的狹小。如：「他那管管之見，聽聽就好，你又何須在意？」,NA,427
jian3~jian3,jiǎn~jiǎn,簡簡,简简,竹,NA,keanX~keanX,*kˤre[n]ʔ~*kˤre[n]ʔ,NA,NA,廣大、盛大的樣子。詩經．周頌．執競：「降福簡簡，威儀反反。」,NA,591
ti4~ti4,tì~tì,籊籊,籊籊,竹,NA,thek~thek,NA~NA,NA,NA,NA,NA,1483
ji2~ji2,jí~jí,籍籍,籍籍,竹,NA,dzjek~dzjek,*[dz]Ak~*[dz]Ak,NA,NA,猶眾口喧喧甚囂塵上。漢書．卷五十三．景十三王傳．江都易王劉非傳：「國中口語籍籍，慎無復至江都。」漢書．卷六十六．劉屈氂傳：「事籍籍如此，何謂祕也？」縱橫散落的樣子。漢書．卷六十三．武五子傳．燕刺王劉旦傳：「髮紛紛兮寘渠，骨籍籍兮亡居。」聲名盛大的樣子。文選．袁淑．效曹子建樂府白馬篇：「籍籍關外來，車徒傾國廛。」唐．韓愈．送僧澄觀詩：「借問經營本何人，道人澄觀名籍籍。」,NA,568
can4~can4,càn~càn,粲粲,粲粲,米,NA,tshanH~tshanH,*[tsʰ]ˤar-s~*[tsʰ]ˤar-s,NA,NA,鮮明華美的樣子。詩經．小雅．大東：「西人之子，粲粲衣服。」,NA,107
jiu1~jiu1,jiū~jiū,糾糾,纠纠,糸,NA,kjiwX~kjiwX,*k<r>iwʔ~*k<r>iwʔ,NA,NA,纏繞的樣子。詩經．魏風．葛屨：「糾糾葛屨，可以履霜。」雄壯勇武的樣子。後漢書．卷三十七．桓榮傳．章懷太子．注引謝承書曰：「上嘗歎曰：『糾糾武夫，公侯干城，何湯之謂也。』」亦作「赳赳」。,NA,665
lei2~lei2,léi~léi,累累,累累,糸,NA,ljwe~ljwe,*[r]oj~*[r]oj,NA,NA,繁多、重積的樣子。漢．董仲舒．春秋繁露．順命：「春秋列序位卑尊之陳，累累乎可得而觀也。」明．梁辰魚．浣紗記．第七齣：「況累累數對璠璵，更纖纖一雙花蕊。」亦作「纍纍」。屢屢。穀梁傳．哀公十三年：「吳，東方之大國也。累累致小國以會諸侯，以合乎中國。」亦作「纍纍」。繁多、重積的樣子。禮記．樂記：「倨中矩，句中鉤，纍纍乎端如貫珠。」漢書．卷九十三．佞幸傳．石顯傳：「印何纍纍，綬若若邪！」如：「果實纍纍」。亦作「累累」。瘦弱、疲憊的樣子。禮記．玉藻：「喪容纍纍，色容顛顛。」元．馬祖常．室婦歎詩：「翁姑帶索行纍纍，弱兒失爺夫失妻。」失意、不得志的樣子。史記．卷四十七．孔子世家：「纍纍若喪家之狗。」或作「儽儽」。屢屢。唐．柳宗元．三戒：「晝纍纍與人兼行，夜則竊齧鬥暴，其聲萬狀，不可以寢。」亦作「累累」。,NA,800
xi4~xi4,xì~xì,細細,细细,糸,NA,sejH~sejH,*[s]ˤe(k)-s~*[s]ˤe(k)-s,NA,NA,仔細、詳細。文明小史．第三十二回：「你將此情形細細的告訴他。」輕微的樣子。唐．杜甫．宣政殿退朝晚出左掖詩：「宮草微微承委佩，鑪煙細細駐遊絲。」極細。如:「細細的麵條。」緩慢的樣子。唐．杜甫．江畔獨步尋花七絕句七首之七：「繁枝容易紛紛落，嫩葉商量細細開。」緊密。宋．蘇軾．風水洞二首和李節推詩：「細細龍鱗生亂石，團團羊角轉空巖。」,NA,1644
sui2~sui2,suí~suí,綏綏,绥绥,糸,NA,swij~swij,*s.nuj~*s.nuj,NA,NA,走路遲緩的樣子。詩經．衛風．有狐：「有狐綏綏，在彼淇梁。」安泰的樣子。荀子．儒效：「綏綏兮其有文章也。」落下的樣子。宋．梅堯臣．五月十日雨中飲詩：「梅天下梅雨，綏綏如亂麻。」,NA,1426
chuo4~chuo4,chuò~chuò,綽綽,绰绰,糸,NA,tsyhak~tsyhak,*tʰawk~*tʰawk,NA,NA,NA,NA,219
mian2~mian2,mián~mián,綿綿,绵绵,糸,NA,mjen~mjen,NA~NA,NA,NA,形容連續不絕。詩經．王風．葛藟：「綿綿葛藟，在河之滸。」唐．白居易．長恨歌：「天長地久有時盡，此恨綿綿無絕期。」,NA,1021
mian2~man2,mián~mán,綿蠻,绵蛮,NA,NA,mjen~maen,NA~*mˤro[n],NA,NA,泛指鳥語。明．劉兌．金童玉女嬌紅記：「一會價弄睆睍新腔，一會價學綿蠻妙語。」詩經小雅的篇名。共三章。根據詩序：「綿蠻，微臣刺亂也。」或謂微臣苦於行役之詩。首章二句為：「綿蠻黃鳥，止於丘阿。」,NA,1019
mian2~mian2,mián~mián,緜緜,緜緜,糸,NA,mjen~mjen,NA~NA,NA,NA,NA,NA,1020
mian2~man2,mián~mán,緜蠻,緜蛮,NA,NA,mjen~maen,NA~*mˤro[n],NA,NA,NA,NA,1018
ji1~ji1,jī~jī,緝緝,缉缉,糸,NA,tship~tship,*[tsʰ][ə]p~*[tsʰ][ə]p,NA,NA,私語聲。詩經．小雅．巷伯：「緝緝翩翩，謀欲譖人。」,NA,559
huan3~huan3,huǎn~huǎn,緩緩,缓缓,糸,NA,hwanX~hwanX,*[ɢ]ʷˤa[n]ʔ~*[ɢ]ʷˤa[n]ʔ,NA,NA,慢慢。宋．蘇軾．陌上花詩三首之一：「遺民幾度垂垂老，遊女長歌緩緩歸。」紅樓夢．第十七、十八回：「忽見一對紅衣太監騎馬緩緩的走來，至西街門下了馬。」近慢慢、徐徐反忽忽,NA,502
piao3~piao3,piǎo~piǎo,縹縹,缥缥,糸,NA,phjew~phjew,NA~NA,NA,NA,輕舉的樣子。漢書．卷四十八．賈誼傳：「鳳縹縹其高逝兮，夫固自引而遠去。」,atl pron piao1~piao1,1177
