arthur,thomas,traditional,simplified,radsup,morphology,MC,OC,variant,Kroll,zdic,note,id
ni3~ni3,nǐ~nǐ,儗儗,儗儗,人,RED,ngiX-ngiX,NA~NA,NA,NA,草木繁盛的樣子。漢書．卷二十四．食貨志上：「故其詩曰：『或芸或芓，黍稷儗儗。』」亦作「薿薿」。迷惑不解的樣子。唐．柳宗元．夢歸賦：「若有鉥予以往路兮，馭儗儗以回復。」,NA,1067
biao1~biao1,biāo~biāo,儦儦,儦儦,人,RED,pjew~pjew,NA~NA,NA,NA,行人眾多的樣子。詩經．齊風．載驅：「汶水滔滔，行人儦儦。」,NA,74
you1~you1,yōu~yōu,優優,优优,人,RED,'juw~'juw,*ʔ(r)u~*ʔ(r)u,NA,NA,和樂的樣子。詩經．商頌．長發：「敷政優優，百祿是遒。」寬裕的樣子。禮記．中庸：「優優大哉，禮儀三百，威儀三千。」,NA,1953
lei2~lei2,léi~léi,儽儽,儽儽,人,RED,lwojH~lwojH,*[r]ˤuj-s~*[r]ˤuj-s,NA,NA,NA,same as 689 690,799
wu4~wu4,wù~wù,兀兀,兀兀,NA,RED,ngwot-ngwot,*[ŋ]ˤut~*[ŋ]ˤut,NA,"(med.) stuck still, motioness, transfixed; dazed and befuddled, blank and rigit; failure and frustration, suffer in torment",高聳矗立的樣子。唐．楊乘．南徐春日懷古詩：「興亡山兀兀，今古水渾渾。」明．朱權．荊釵記．第十九齣：「巍巍駕海紫金梁，兀兀擎天碧玉柱。」依然。金．元好問．雁門道中書所見詩：「金城留旬浹，兀兀醉歌舞。」勞苦不息的樣子。唐．韓愈．進學解：「焚膏油以繼晷，恆兀兀以窮年。」,NA,1607
jing1~jing1,jīng~jīng,兢兢,兢兢,克,RED,king king,*k(r)əŋ~*k(r)əŋ,NA,"strong and stout; cautious and careful, wary",小心謹慎的樣子。書經．皋陶謨：「無教逸欲有邦，兢兢業業，一日二日萬幾。」,NA,653
ran3~ran3,rǎn~rǎn,冉冉,冉冉,NA,RED,nyemX-nyemX,NA~NA,"冉冉,苒苒","advancing apace, steadily approaching, insensible gradualness; gently hanging, lithely bending",緩慢行進的樣子。楚辭．屈原．離騷：「老冉冉其將至兮，恐脩名之不立。」醒世恆言．卷四．灌園叟晚逢仙女：「忽見月影下，一青衣冉冉而來。」柔弱下垂的樣子。文選．古詩十九首．冉冉孤生竹：「冉冉孤生竹，結根泰山阿。」文選．曹植．美女篇：「柔條紛冉冉，葉落何翩翩。」濃密迷漫的樣子。元．王實甫．西廂記．第二本．第一折：「耳邊廂金鼓連天振，征雲冉冉，土雨紛紛。」明．王夫之．玉樓春．娟娟片月涵秋影詞：「綠雲冉冉粉初勻，玉露泠泠香自省。」,NA,1328
jiong3~jiong3,jiǒng~jiǒng,冏冏,冏冏,冂,RED,kjwaengX kjwaengX,NA~NA,NA,"glowing gloriously, glinting and gleaming",NA,NA,658
leng3~leng3,lěng~lěng,冷冷,冷冷,冫,RED,lengX lengX,NA~NA,NA,onom. Zither playing clear and melodious notes,寒冷。宋．王偊偁．李太白真讚序：「冷冷碧江，下浸秋石。」態度冷漠。如：「他只對她冷冷的一笑，一句寒暄的話也不肯說。」,NA,808
lin3~lin3,lǐn~lǐn,凜凜,凛凛,冫,RED,limX limX,*[r][ə]mʔ~*[r][ə]mʔ,NA,"stinging chill, numbingly cold; quaking with fear",NA,NA,876
diao1~diao1,diāo~diāo,刁刁,刁刁,𠃌,RED,tew tew,NA~NA,NA,flutter and flitter; quiver and shiver,動搖的樣子。多用以形容草木。莊子．齊物論：「厲風濟，則眾竅為虛。而獨不見之調調之刁刁乎？」郭象．注：「調調、刁刁，動搖貌也。」,NA,292
ci4~ci4,cì~cì,刺刺,刺刺,刀,RED,tshjeH tshjeH,*[tsʰ]ek-s~*[tsʰ]ek-s,NA,"piercing (wind, cold), sharp and stinging; verbose",多言的樣子。唐．韓愈．送殷員外序：「丁寧顧婢子，語刺刺不能休。」,NA,227
la4~la1,là~lā,剌剌,剌剌,刀,RED,lat lat,*mə.rˤat (~ C.rˤat ?)~*mə.rˤat (~ C.rˤat ?),NA,onom. Gusting or lapping wind,狀聲詞。形容風聲或拍擊聲。唐．李商隱．送千牛李將軍赴闕五十韻：「去程風剌剌，別夜漏丁丁。」語助詞。表示加重語氣。元．王曄．桃花女．第三折：「倒做這等魘鎮事，欺心剌剌的。我不去！我不去！」紅樓夢．第二十六回：「薛蟠道：『越發說的人熱剌剌的丟不下。』」,NA,773
jie2~jie2,jié~jié,劫劫,劫劫,力,RED,kjaep kjaep,*k(r)ap~*k(r)ap,NA,in a hurry; age after age (time),追求不息的樣子。唐．韓愈．貞曜先生墓誌銘：「人皆劫劫，我獨有餘。」世世。唐．白居易．畫水月菩薩讚：「生生劫劫，長為我師。」,NA,632
xiong1~xiong1,xiōng~xiōng,匈匈,匈匈,勹,RED,xjowng-xjowng,NA~NA,NA,"hue and cry, row and racket, blare and babble; uproar, commotion; scurry and scramble, unrest and agitation",喧嘩、吵嚷。莊子．在宥：「自三代以下者，匈匈焉，終以賞罰為事，彼何暇安其性命之情哉！」漢書．卷六十五．東方朔傳：「天不為人之惡寒而輟其冬，地不為人之惡險而輟其廣，君子不為小人之匈匈而易其行。」動亂不安。史記．卷七．項羽本紀：「天下匈匈數歲者，徒以吾兩人耳，願與漢王挑戰決雌雄，毋徒苦天下之民父子為也。」南史．卷七十．循吏傳．沈瑀傳：「不然人情匈匈，皆思改計；若不早圖，眾散難合。」,NA,1712
qu1~qu1,qū~qū,區區,区区,NA,RED,khju-khju,*qˤ(r)o~*qˤ(r)o,NA,"trifling and trivial, nugatory, of little or no account > self-depreciatory ref. my insignificant self",微小。左傳．襄公十七年：「宋國區區，而有詛有祝，禍之本也。」舊唐書．卷一一一．張鎬傳：「臣聞天子修福，要在安養含生，靖一風化，未聞區區僧教，以致太平。」近戔戔自稱的謙詞。文選．李陵．答蘇武書：「區區之心，切慕此耳。」文選．李密．陳情表：「母孫二人更相為命，是以區區不能廢遠。」志得意滿的樣子。商君書．修權：「今亂世之君臣，區區然皆擅一國之利，而管一官之重，以便其私。」忠誠、愛戀。文選．古詩十九首．孟冬寒氣至：「一心抱區區，懼君不識察。」樂府詩集．卷七十三．雜曲歌辭十三．古辭．焦仲卿妻：「新婦謂府吏：『感君區區懷，君既若見錄，不久望君來。』」胸襟不開朗。董西廂．卷一：「莫區區，好天良夜且追遊。」憨愚，死心眼。樂府詩集．卷七十三．雜曲歌辭十三．古辭．焦仲卿妻：「阿母謂府吏：『何乃太區區。』」隋書．卷六十四．來護兒傳：「會為國滅賊以取功名，安能區區久事隴畝！」辛苦、殷勤。董西廂．卷一：「區區四海遊學，一年多半，身在天涯。」元．鄭光祖．㑳梅香．第二折：「小生區區千里而來，只為小姐這門親事。」,NA,1304
yan1~yan1,yān~yān,厭厭,厌厌,NA,RED,'jem-'jem,*ʔep~*ʔep,NA,"satisfied, contend(ed); tranquil; still and serene; darkly dim",安靜的樣子。詩經．小雅．湛露：「厭厭夜飲，不醉無歸。」茂盛的樣子。詩經．周頌．載芟：「厭厭其苗，綿綿其麃。」露水重的樣子。元．鄭光祖．倩女離魂．第二折：「趁著這厭厭露華，對著這澄澄月下，驚的那呀呀呀寒鴈起平沙。」暗淡、微弱的樣子。漢書．卷七十五．李尋傳：「列星皆失色，厭厭如滅。」虛弱生病的樣子。元．白樸．東牆記．第一折：「早是這兩日茶飯不進，厭厭瘦削。」初刻拍案驚奇．卷十六：「只是王氏生來嬌怯，厭厭弱病嘗不離身的。」亦作「懨懨」。,yan1 usually pronounced as yan4,1763
sou3~sou3,sǒu~sǒu,叟叟,叟叟,NA,RED,sjuw-sjuw,*s-ruʔ (dialect: > *sruʔ > MC srjuwX > sruwX > suwX)~*s-ruʔ (dialect: > *sruʔ > MC srjuwX > sruwX > suwX),NA,onom. of washing rice: shyoo-shyoo,狀聲詞。形容淘米的聲音。詩經．大雅．生民：「釋之叟叟，烝之浮浮。」亦作「溲溲」。,radical support?,1417
you1~you1,yōu~yōu,呦呦,呦呦,口,RED,'jiw-'jiw,NA~NA,NA,onom. of the bleating or mewing of dee: nyaaoo-nyaaoo; (med.) onom. of weeping: ngew-ngew,狀聲詞。形容鹿鳴聲。詩經．小雅．鹿鳴：「呦呦鹿鳴，食野之苹。」唐．李頎．聽董大彈胡笳兼寄語弄房給事詩：「迸泉颯颯飛木末，野鹿呦呦走堂下。」,NA,1952
che4~che4,chè~chè,呫呫,呫呫,口,RED,tsyhep tsyhep,NA~NA,NA,"babble on, chatter",低聲細語。宋．黃庭堅．次韻正仲三丈自衡山返命舍驛過外舅師厚贈答詩：「昏昏市井氣，呫呫兒女語。」多話的樣子。唐．柳宗元．讀韓愈所著毛穎傳後題：「貪常嗜瑣者，猶呫呫然動其喙，亦勞甚矣乎。」,NA,173
nao2~nao2,náo~náo,呶呶,呶呶,口,RED,nraew-nraew,NA~NA,NA,"(med.) rdup., yak and grab, meaningless; also, (med.) bawl and bray, yap and wail",形容說起話來沒完沒了、喧嚷不停。唐．柳宗元．答韋中立論師道書：「豈可使呶呶者早暮咈吾耳，騷吾心，則固僵仆煩憒，逾不可過矣。」,NA,1064
duo1~duo1,duō~duō,咄咄,咄咄,口,RED,twot twot,*[t]ˤut~*[t]ˤut,NA,"gasp of surprise; sigh of disatisfaction; expression of impatience (e.g., tsk tsk, tut tut)",感嘆聲、驚怪聲。後漢書．卷八十三．逸民傳．嚴光傳：「咄咄子陵，不可相助為理邪？」唐．袁郊．紅線：「嵩聞之，日夜憂悶，咄咄自語，計無所出。」,NA,322
jiao1~jiao1,jiāo~jiāo,咬咬,咬咬,口,RED,kaew-kaew,NA~NA,NA,"chaffering, chittering of birds",狀聲詞。形容鳥叫的聲音。文選．禰衡．鸚鵡賦：「采采麗容，咬咬好音。」,jiao1 usually pronounced yao3,601
ji1~ji1,jī~jī,唧唧,唧唧,口,RED,tsik tsik,NA~NA,NA,"onom. Sigh of sadness or admiration; onom. Bird's chirping, cicada's humming, cricket's chirping",狀聲詞：(1)​ 形容機杼聲或嘆息聲。南朝梁．無名氏．木蘭詩二首之一：「唧唧復唧唧，木蘭當戶織。不聞機杼聲，唯聞女歎息。」(2)​ 形容嘆息聲。唐．白居易．琵琶行：「我聞琵琶已嘆息，又聞此語重唧唧。」(3)​ 形容蟲鳴聲。唐．王維．青雀歌：「猶勝黃雀爭上下，唧唧空倉復若何。」唐．李郢．宿杭州虛白堂詩：「秋月斜明虛白堂，寒蛩唧唧樹蒼蒼。」(4)​ 形容鳥鳴聲。唐．劉禹錫．鶗鴂吟：「如何上春日，唧唧滿庭飛。」(5)​ 形容哭泣聲。宋．蘇軾．岐亭詩五首之一：「醒時夜向闌，唧唧銅缾泣。」,NA,560
beng3~beng3,běng~běng,唪唪,唪唪,口,RED,buwngX buwngX,NA~NA,NA,"lush (of fruit), profusely plentiful",多實的樣子。詩經．大雅．生民：「蓺之荏菽，荏菽旆旆，禾役穟穟，麻麥幪幪，瓜瓞唪唪。」,NA,55
wei3~wei3,wěi~wěi,唯唯,唯唯,口,RED,ywijX-ywijX,*ɢʷij (< *ɢʷuj?)~*ɢʷij (< *ɢʷuj?),NA,"stammering self-depreciating response, quite-so, quite-so",恭敬應諾之詞。漢書．卷五十七．司馬相如傳上：「齊王曰：『雖然，略以子之所聞見言之。』僕對曰：『唯唯。臣聞楚有七澤，嘗見其一，未睹其餘也。』」聊齋志異．卷十一．王者：「明日，衣冠者召之去，曰：『今日可見矣。』州佐唯唯。」,wei3 usually reads as wei2,1580
tun1~tun1,tūn~tūn,啍啍,啍啍,口,RED,thwon-thwon,NA~NA,NA,"jumbled and jangled, noisy and annoying; insist(ent) and reiterate(d)",遲重緩慢的樣子。詩經．王風．大車：「大車啍啍，毳衣如璊。」多言。孔子家語．卷一．五儀解：「無取啍啍，捷捷貪也，鉗鉗亂也，啍啍誕也。」,NA,1531
e4~e4,è~è,啞啞,哑哑,口,RED,'eak-'eak,*ʔˤraʔ~*ʔˤraʔ,NA,"onom. of laughter, heh-heh",狀聲詞：(1)​ 形容小兒學語聲。唐．于鵠．古詞三首之二：「新長青絲髮，啞啞言語黠。」聊齋志異．卷二．口技：「小兒啞啞，貓貓唔唔。」(2)​ 形容鳥鳴聲。淮南子．原道：「故夫烏之啞啞，鵲之唶唶，豈嘗為寒暑燥溼，變其聲哉。」唐．白居易．慈烏夜啼詩：「慈烏失其母，啞啞吐哀音。」(3)​ 形容車聲。宋．陸游．滄灘詩：「嘔嘔啞啞車轉急，舟人已在沙際立。」狀聲詞。形容笑聲。易經．震卦．初九：「震來虩虩，後笑言啞啞，吉。」清．張爾岐．蒿庵集．卷一：「今夫人生而呱呱以啼，啞啞以笑。」,NA,329
ya1~ya1,yā~yā,啞啞,哑哑,口,RED,'ae-'ae,*ʔˤraʔ~*ʔˤraʔ,NA,"onom. of a daw's or crow's cry, ca-caw!",狀聲詞：(1)​ 形容小兒學語聲。唐．于鵠．古詞三首之二：「新長青絲髮，啞啞言語黠。」聊齋志異．卷二．口技：「小兒啞啞，貓貓唔唔。」(2)​ 形容鳥鳴聲。淮南子．原道：「故夫烏之啞啞，鵲之唶唶，豈嘗為寒暑燥溼，變其聲哉。」唐．白居易．慈烏夜啼詩：「慈烏失其母，啞啞吐哀音。」(3)​ 形容車聲。宋．陸游．滄灘詩：「嘔嘔啞啞車轉急，舟人已在沙際立。」狀聲詞。形容笑聲。易經．震卦．初九：「震來虩虩，後笑言啞啞，吉。」清．張爾岐．蒿庵集．卷一：「今夫人生而呱呱以啼，啞啞以笑。」,NA,1758
ya3~ya3,yǎ~yǎ,啞啞,哑哑,口,RED,'aeX-'aeX,*ʔˤraʔ~*ʔˤraʔ,NA,gibber-jabber,狀聲詞：(1)​ 形容小兒學語聲。唐．于鵠．古詞三首之二：「新長青絲髮，啞啞言語黠。」聊齋志異．卷二．口技：「小兒啞啞，貓貓唔唔。」(2)​ 形容鳥鳴聲。淮南子．原道：「故夫烏之啞啞，鵲之唶唶，豈嘗為寒暑燥溼，變其聲哉。」唐．白居易．慈烏夜啼詩：「慈烏失其母，啞啞吐哀音。」(3)​ 形容車聲。宋．陸游．滄灘詩：「嘔嘔啞啞車轉急，舟人已在沙際立。」狀聲詞。形容笑聲。易經．震卦．初九：「震來虩虩，後笑言啞啞，吉。」清．張爾岐．蒿庵集．卷一：「今夫人生而呱呱以啼，啞啞以笑。」,NA,1759
yong2~yong2,yóng~yóng,喁喁,喁喁,口,RED,ngjowng-ngjowng,NA~NA,"喁喁, 顒顒, 顒然","eagerly expectant; answerin agreement, be in tune with, jibe with; chime in compliantly; accompany",低語聲。聊齋志異．卷二．聶小倩：「聞舍北喁喁，如有家口。」眾人向慕的樣子。史記．卷一一七．司馬相如傳：「延頸舉踵，喁喁然皆爭歸義。」三國志．卷三十五．蜀書．諸葛亮傳：「天下英雄喁喁，冀有所望。如不從議者，士大夫各歸求主，無為從公也。」,NA,1948
nan2~nan2,nán~nán,喃喃,喃喃,口,RED,neam-neam,NA~NA,NA,"nam-nam, onom. of  whispering; also, (med.) of reading aloud in a murmur, mutter; also, (med.) of gabbling birds",狀聲詞：(1)​ 形容低聲說話的聲音。如：「喃喃細語」。元．楊訥．西游記．第十三齣：「吃得醉薰酣，語喃喃。」(2)​ 形容讀書的聲音。全唐詩．卷八○六．寒山詩：「仙書一兩卷，樹下讀喃喃。」,NA,1062
jie1~jie1,jiē~jiē,喈喈,喈喈,口,RED,keaj keaj,*kˤrəj~*kˤrəj,NA,onom. Bird calls; onom. Harmonious music; onom. Brisk brushing of wind,狀聲詞：(1)​ 形容和諧的鐘鼓聲。詩經．小雅．鼓鐘：「鼓鐘喈喈，淮水湝湝，憂心且悲。」(2)​ 形容鳥鳴聲。詩經．周南．葛覃：「黃鳥于飛，集于灌木，其鳴喈喈。」(3)​ 形容鸞鈴聲。詩經．大雅．蒸民：「四牡騤騤，八鸞喈喈。」,NA,623
die2~die2,dié~dié,喋喋,喋喋,口,RED,deap deap,NA~NA,諜諜,chatty; rambling,多話的樣子。史記．卷一一○．匈奴傳：「嗟土室之人，顧無多辭，令喋喋而佔佔，冠固何當？」聊齋志異．卷三．連瑣：「所言伊何？乃已喋喋向人！」亦作「諜諜」。,NA,296
yao1~yao1,yāo~yāo,喓喓,喓喓,口,RED,'jew-'jew,NA~NA,NA,"onom. of the stridulation of insects; shrilling, grating; heavy humming",狀聲詞。形容蟲鳴聲。詩經．召南．草蟲：「喓喓草蟲，趯趯阜螽。」,NA,1809
chuan3~chuan3,chuǎn~chuǎn,喘喘,喘喘,口,RED,tsyhwenX tshywenX,*[tʰ]orʔ~*[tʰ]orʔ,NA,huffing and puffing,NA,NA,208
xu3~xu3,xǔ~xǔ,喣喣,喣喣,火,RED,xjuX-xjuX,NA~NA,NA,"kind(ly), amiable; (med.) cautious and careful",NA,radical support?,1736
huang2~huang2,huáng~huáng,喤喤,喤喤,口,RED,hwang hwang,NA~NA,NA,onom. Infant crying or bawling; onom. Tintinnabulation of bells,狀聲詞：(1)​ 形容小孩的啼哭聲。詩經．小雅．斯干：「乃生男子，載寢之床，載衣之裳，載弄之璋，其泣喤喤。」(2)​ 形容聲音洪亮而和諧。詩經．周頌．執競 :「鐘鼓喤喤，磬筦將將。」,NA,509
he4~he4,hè~hè,嗃嗃,嗃嗃,口,RED,xaek xaek,NA~NA,NA,"cruel and ruthless, grim and grisly",嚴肅冷酷的樣子。易經．家人卦．象曰：「家人嗃嗃，未失也；婦人嘻嘻，失家節也。」,嗃 he4 also xiao1 (MC xaew) or xiao4 (MC xaewH),463
ge3~ge3,gě~gě,嗑嗑,嗑嗑,口,RED,kap kap,NA~NA,NA,"jabber, yap, prattle",多話的樣子。孔叢子．前集．儒服：「子路嗑嗑，尚飲十榼。」,ge3 also he2 (MC hjep) and xia1 (MC khaep),411
chen1~chen1,chēn~chēn,嗔嗔,嗔嗔,口,RED,den den,NA~NA,NA,onom. Drum beats,NA,NA,175
wu1~wu1,wū~wū,嗚嗚,呜呜,口,RED,'u-'u,NA~NA,NA,"onom. Of melodious song; (med.) onom. of comforting: there, there",形容歡唱、呼叫的聲音。史記．卷八十七．李斯傳：「夫擊甕、叩缶、彈箏、搏髀，而歌呼嗚嗚快耳者，真秦之聲也。」形容低沉、幽怨的聲音。宋．蘇軾．赤壁賦：「其聲嗚嗚然，如怨如慕，如泣如訴。」狀聲詞。形容汽笛的聲音。如：「汽笛嗚嗚的響起，船就要開了。」,NA,1598
ao2~ao2,áo~áo,嗷嗷,嗷嗷,口,RED,ngaw ngaw,NA~NA,謷謷,"hue and cry, raucous racket, brawling clamor; honking of geese and cranes； oh no!",狀聲詞：(1)​ 形容哀號聲。詩經．小雅．鴻鴈：「鴻鴈于飛，哀鳴嗷嗷。」宋．歐陽修．綠竹堂獨飲詩：「殘花不共一日看，東風送哭聲嗷嗷。」(2)​ 形容眾口嘈雜聲。漢書．卷三十六．楚元王劉交傳：「無罪無辜，讒口嗷嗷。」或作「熬熬」。,NA,32
cao2~cao2,cáo~cáo,嘈嘈,嘈嘈,口,RED,dzaw dzaw,NA~NA,NA,dinned and deafened,聲音雜亂。唐．白居易．琵琶行：「大弦嘈嘈如急雨，小弦切切如私語。」喧鬧、吵鬧。兒女英雄傳．第十五回：「我今日遇見這等一個知己愚兄，就喝口酒，……竟跟著嘈嘈，又說這東西，怎麼犯脾溼。」,NA,120
jiao1~jiao1,jiāo~jiāo,嘐嘐,嘐嘐,口,RED,kaew-kaew,NA~NA,NA,"onom. of cock's crow, cocoroo!",形容言語誇張、言行不一致。孟子．盡心下：「何以謂之狂也？曰：『其志嘐嘐然。』」,NA,602
xiao1~xiao1,xiāo~xiāo,嘐嘐,嘐嘐,口,RED,xaew-xaew,NA~NA,NA,"talk magniloquently, vaunt, exaggerate, blow hard",形容言語誇張、言行不一致。孟子．盡心下：「何以謂之狂也？曰：『其志嘐嘐然。』」,NA,1688
hui4~hui4,huì~huì,嘒嘒,嘒嘒,口,RED,xwejH xwejH,*qʷʰˤi[t]-s~*qʷʰˤi[t]-s,NA,onom. Cicada; onom. Carriage grelots (chink chink); onom. Pipes or flutes shrilling and shrieking,狀聲詞。形容蟬鳴聲。詩經．小雅．小弁：「菀彼柳斯，鳴蜩嘒嘒。」聲音和諧中節。詩經．小雅．采菽：「其旂淠淠，鸞聲嘒嘒。」,NA,541
xu1~xu1,xū~xū,嘔嘔,呕呕,口,RED,xju-xju,*qˤ(r)oʔ~*qˤ(r)oʔ,NA,"sweet and soothing, dulcet and pleasing, easily agreeable",和悅的樣子。史記．卷九十二．淮陰侯傳：「項王見人恭敬慈愛，言語嘔嘔。」,xu1 usually pronounced as ou1,1728
ze2~ze2,zé~zé,嘖嘖,啧啧,口,RED,tsreak-tsreak,NA~NA,NA,"twittering and chirping of birds, creaking of insects; clucking and chirking in approbation",狀聲詞：(1)​ 形容蟲鳥鳴叫聲。爾雅．釋鳥：「行雇唶唶，宵雇嘖嘖。」邢昺．疏：「唶唶、嘖嘖，鳥聲貌也。」初刻拍案驚奇．卷三：「那邊地方裡居民，家家蓄養蜈蚣，有大尺餘者，多放在枕畔或枕中，若有蛇至，蜈蚣便嘖嘖作聲。」(2)​ 形容咂嘴聲。表示讚嘆、驚奇。初刻拍案驚奇．卷六：「狄氏隨手就囊中取起來看，口裡嘖嘖道：『果然好珠！』」文明小史．第二十一回：「楊編修嘖嘖稱讚，說他輕了十年年紀。」形容爭相言語、議論。明史．卷二四五．周宗建傳：「近日政事，外廷嘖嘖，咸謂奧窔之中，莫可測識。」,NA,2023
xiao1~xiao1,xiāo~xiāo,嘵嘵,哓哓,口,RED,xew-xew,NA~NA,NA,exclamation of fright: hyai,恐懼聲。詩經．豳風．鴟鴞：「予室翹翹，風雨所漂搖，予維音嘵嘵。」爭辯聲。唐．韓愈．重答張籍書：「擇其可語者誨之，猶時與吾悖，其聲嘵嘵。」多言的樣子。初刻拍案驚奇．卷一：「口中嘵嘵說：『悔氣！來得遲了。』」聊齋志異．卷十．胭脂：「彼嘵嘵者直以桎梏靜之，何怪覆盆之下多沉冤哉！」,NA,1690
tan1~tan1,tān~tān,嘽嘽,嘽嘽,口,RED,than-than,*tʰˤar~*tʰˤar,NA,"panting and snorting, exhausted and spent; unnumbered and legion, drawn-out in throngs",牲畜喘息的樣子。詩經．小雅．四牡：「四牡騑騑，嘽嘽駱馬。」舒暢喜樂的樣子。詩經．大雅．崧高：「申伯番番，既入于謝，徒御嘽嘽。」眾多。詩經．小雅．釆芑：「戎車嘽嘽，嘽嘽焞焞，如霆如雷。」,NA,1443
zun3~zun3,zǔn~zǔn,噂噂,噂噂,口,RED,tswonX-tswonX,NA~NA,NA,"confused chatter, jumbled babble, cross-talk",狀聲詞。形容吵雜聲。唐．盧照鄰．釋疾文．命曰：「霓為裳兮羽為旗，雷為車兮電為斾，噂噂兮上馳，遙遙兮橫厲。」相對傾談。漢．焦延壽．易林．卷一．乾之困：「噂噂所言，莫知我垣。」,NA,2109
jiao1~jiao1,jiāo~jiāo,噍噍,噍噍,口,RED,dzjew-dzjew,*[dz]ewk-s~*[dz]ewk-s,NA,onom. Pheasant's cry,NA,"噍 jiao1 (MC dzjew), jiu1 (MC tsjuw), jiao4 (dzjewH)",599
jiao4~jiao4,jiào~jiào,噭噭,噭噭,口,RED,djewX,NA~NA,NA,"onom. High-pitched cry, like howling of gibbons or keening wail",狀聲詞：(1)​ 形容哭泣聲。莊子．至樂：「人且偃然寢於巨室，而我噭噭然，隨而哭之。」文選．潘岳．楊仲武誄：「慈母哀哀，慈母痛心疾首。噭噭同生，悽悽諸舅。」(2)​ 形容鳥獸鳴聲。文選．曹植．雜詩六首之三：「飛鳥遶樹翔，噭噭鳴索群。」唐．陳子昂．晚次樂鄉縣詩：「如何此時恨，噭噭夜猿鳴。」,NA,617
jie1~jie1,jiē~jiē,嚌嚌,哜哜,口,RED,kej kej,NA~NA,NA,squawk and screech,狀聲詞：(1)​ 形容鳥獸的鳴叫聲。文選．班彪．北征賦：「雁邕邕以群翔兮，鵾雞鳴以嚌嚌。」(2)​ 形容管弦的淒切聲。漢．揚雄．太玄經．卷二．樂：「鐘鼓喈喈，管絃嚌嚌。」,嚌 jie1 also ji4 (MC dzejH),625
ying1~ying1,yīng~yīng,嚶嚶,嘤嘤,口,RED,'eang-'eang,NA~NA,NA,"onom. birdcall, crying of birds, wee-ang, wee-ang wawk",狀聲詞：(1)​ 形容禽鳥和鳴的聲音。詩經．小雅．伐木：「伐木丁丁，鳥鳴嚶嚶。」南朝梁．吳均．與朱元思書：「好鳥相鳴，嚶嚶成韻。」(2)​ 形容低語聲。西遊記．第二十回：「只見一老者，斜倚竹床之上，口裡嚶嚶的念佛。」聊齋志異．卷四．辛十四娘：「聞房內嚶嚶膩語，生乘醉搴簾。」(3)​ 形容低泣聲。聊齋志異．卷一．青鳳：「尾而聽之，訶詬萬端。聞青鳳嚶嚶啜泣。」(4)​ 形容清脆而細的聲音。漢．陳琳．神女賦：「文絳虯之奕奕，鳴玉鸞之嚶嚶。」比喻朋友間志趣相投。文選．謝瞻．於安城答靈運詩：「華萼相光飾，嚶嚶悅同響。」,NA,1934
ao2~ao2,áo~áo,囂囂,嚣嚣,NA,RED,ngaw-ngaw,*[ŋ]ˤaw~*[ŋ]ˤaw,NA,brawl and brouhaha; moiling mob; rife and riotous,無欲自得的樣子。孟子．盡心上：「人知之，亦囂囂；人不知，亦囂囂。」言語紛紜的樣子。詩經．小雅．十月之交：「無罪無辜，讒口囂囂。」,radical support?,35
xiao1~xiao1,xiāo~xiāo,囂囂,嚣嚣,NA,RED,xjew-xjew,*[ŋ]ˤaw~*[ŋ]ˤaw,NA,well and fully pleased,無欲自得的樣子。孟子．盡心上：「人知之，亦囂囂；人不知，亦囂囂。」言語紛紜的樣子。詩經．小雅．十月之交：「無罪無辜，讒口囂囂。」,radical support?,1691
qun1~qun1,qūn~qūn,囷囷,囷囷,NA,RED,khwin-khwin,*kʰrun~*kʰrun,NA,"(med.) twisting and turning, curved and winding",屈曲盤旋的樣子。唐．杜牧．阿房宮賦：「盤盤焉，囷囷焉，蜂房水渦矗，不知乎幾千萬落。」,radical support?,1324
kan3~kan3,kǎn~kǎn,坎坎,坎坎,土,RED,khomX khomX,*[k]ʰˤomʔ~*[k]ʰˤomʔ,NA,"onom. Striking an object (drum, pan); onom. Drumming (high pitch and fast beat); also empty, sunk and pitted",擊鼓聲。詩經．小雅．伐木：「坎坎鼓我，蹲蹲舞我。」伐木聲。詩經．魏風．伐檀：「坎坎伐檀兮，寘之河之干兮。」不安的樣子。易經．坎卦：「六三，來之坎坎，險且枕。」空乏的樣子。漢．揚雄．太玄經．窮：「羹無糝，其腹坎坎。」不平。唐．柳宗元．弔屈原文：「哀余衷之坎坎兮，獨蘊憤而增傷。」高興、歡喜。爾雅．釋訓：「坎坎、蹲蹲，喜也。」,NA,711
tang2~tang2,táng~táng,堂堂,堂堂,NA,RED,dang-dang,*[d]ˤaŋ~*[d]ˤaŋ,NA,broad and limitless; large and lofty; massive and magnificent,形容人的容貌端正莊嚴。論語．子張：「堂堂乎張也，難與並為仁矣。」形容志氣宏大。宋．岳飛．題新淦古寺壁詩：「正氣堂堂貫斗牛，誓將貞節報君仇。」形容陣容或力量壯大。三國志．卷二十八．魏書．鍾會傳：「段谷、侯和沮傷之氣，難以敵堂堂之陳。」,NA,1460
