arthur,thomas,traditional,simplified,radsup,morphology,MC,OC,variant,Kroll,zdic,note,id
lei2~lei2,léi~léi,轠轠,轠轠,車,RED,lwoj lwoj,NA~NA,NA,"onom. Thundering of carriages and carts; onom. Rumble, rattle",NA,NA,797
tiao2~tiao2,tiáo~tiáo,迢迢,迢迢,辶,RED,dew-dew,NA~NA,NA,"far and distant, far and farther off, progressively far-removed; far into the sky, tall and far-towering",遙遠的樣子。文選．古詩十九首．迢迢牽牛星：「迢迢牽牛星，皎皎河漢女。」宋．劉克莊．沁園春．一卷陰符詞：「長安不見，北望迢迢。」亦作「苕苕」。悠長的樣子。宋．歐陽修．踏莎行．候館梅殘詞：「離愁漸遠漸無窮，迢迢不斷如春水。」高聳的樣子。亦作「苕苕」。,NA,1503
pang2~pang2,páng~páng,逄逄,逄逄,辶,RED,baewng-baewng,NA~NA,NA,"onom. of drumming, bohng-bohng",NA,NA,1116
ti4~ti4,tì~tì,逖逖,逖逖,辶,RED,thek-thek,NA~NA,"惕惕,逖逖","overcome with fear, dreading the thought of",NA,NA,1486
su4~su4,sù~sù,速速,速速,辶,RED,suwk-suwk,*[s]ˤok~*[s]ˤok,NA,"fast, rapid, quick, speedy, swift, apace, immediate; (med.) urgent, pressing, hasten to do",迅速、急速。三國演義．第七十六回：「眾人都叫：『本處人速速投降！』關公大怒，欲上岡殺之。」初刻拍案驚奇．卷十七：「如有來投求報應者，可書『香』字與之，叫他速速歸家。」鄙陋的樣子。後漢書．卷六十下．蔡邕傳：「速速方轂，夭夭是加。」亦作「蔌蔌」。不相親附的樣子。楚辭．劉向．九歎．逢紛：「心戃慌其不我與兮，躬速速其不吾親。」,NA,1424
peng2~peng2,péng~péng,逢逢,逢逢,辶,RED,bjowng bjowng,*[C.b](r)oŋ~*[C.b](r)oŋ,NA,onom. Booming of a drum,狀聲詞。形容鼓聲。詩經．大雅．靈臺：「鼉鼓逢逢，矇瞍奏公。」,逢 peng2 (MC buwng) also feng2 (MC bjowngH),1141
lian2~lian2,lián~lián,連連,连连,辶,RED,ljen ljen,*C.ra[n]~*C.ra[n],NA,"in succession, unbroken, continuously",徐緩的樣子。詩經．大雅．皇矣：「臨衝閑閑，崇墉言言，執訊連連，攸馘安安。」連綿不斷。三國．魏．陳琳．飲馬長城窟行：「長城何連連，連連三千里。」儒林外史．第二十八回：「連連在飯店裡住了幾天，盤纏也用盡了。」,NA,825
di4~di4,dì~dì,逮逮,逮逮,辶,RED,dejH dejH,*m-rˤəp-s~*m-rˤəp-s,NA,"decorous and dignified, with grace and elegance",富盛而熟習的樣子。禮記．孔子閒居：「威儀逮逮，不可選也。」亦作「棣棣」。,逮 di4 (MC dejH) also dai4 (dojH),284
lu4~lu4,lù~lù,逯逯,逯逯,辶,RED,ljowk ljowk,NA~NA,NA,"jumpy, jittery, nervous",行為謹慎。如：「他一向行事逯逯，怎會出此差錯？」平庸無奇。如：「咱們皆是逯逯之輩，有什麼好爭的！」亦作「碌碌」。,NA,936
chuo1~chuo1,chuō~chuō,逴逴,逴逴,辶,RED,trhaewk trhaewk,NA~NA,趠趠,far off; distant,高遠的樣子。楚辭．宋玉．九辯：「春秋逴逴而日高兮，然惆悵而自悲。」,NA,216
yao2~yao2,yáo~yáo,遙遙,遥遥,辶,RED,yew-yew,NA~NA,NA,"distant, remote, in space or time; lengthy, stretching",NA,NA,1817
mai4~mai4,mài~mài,邁邁,迈迈,辶,RED,mwaejH mwaejH,*mˤrat-s~*mˤrat-s,NA,"displeased, disapproving",NA,NA,963
bing3~bing3,bǐng~bǐng,邴邴,邴邴,丙,RED,pjaengX pjaengX,*praŋʔ~*praŋʔ,NA,gleeful and overjoyed,愉悅的樣子。莊子．大宗師：「邴邴乎其似喜乎？崔乎其不得已乎？」,NA,88
yu4~yu4,yù~yù,郁郁,郁郁,邑,RED,'juwk-'juwk,*qʷək~*qʷək,NA,"tasteful and finished, refined and elegant",文采美盛的樣子。論語．八佾：「周監於二代，郁郁乎文哉，吾從周。」香氣濃烈的樣子。文選．司馬相如．上林賦：「郁郁菲菲，眾香發越。」悶悶不樂。史記．卷九十二．淮陰侯傳：「吾亦欲東耳，安能鬱鬱久居此乎？」近邑邑茂盛的樣子。文選．古詩十九首．青青河畔草：「青青河畔草，鬱鬱園中柳。」芳香。文選．劉孝標．廣絕交論：「且心同琴瑟，言鬱郁於蘭茝。」李善．注：「鬱郁，香也。」,radical support?,1995
tan2~tan2,tán~tán,醰醰,醰醰,酉,RED,dom-dom,NA~NA,NA,"mellow and mellifluous, sweet and dulcet (of music)",形容滋味濃厚。文選．王襃．洞簫賦：「哀悁悁之可懷兮，良醰醰而有味。」,NA,1449
yi4~yi4,yì~yì,醳醳,醳醳,酉,RED,yek-yek,NA~NA,NA,"clear and unclouded, of wine",NA,NA,1894
ling2~ling2,líng~líng,鈴鈴,铃铃,金,RED,leng leng,NA~NA,NA,onom. Small clapper bells on carriages,NA,NA,894
yang1~yang1,yāng~yāng,鉠鉠,鉠鉠,金,RED,'jang-'jang,NA~NA,NA,"jangle-jingle, ting-ting, of small balls",NA,NA,1787
zheng1~zheng1,zhēng~zhēng,錚錚,铮铮,金,RED,tsrheang-tsrheang,NA~NA,NA,onom. of struck metal: tching! Tchong!,狀聲詞。形容玉石或金屬碰擊所發的聲音。唐．白居易．夢仙詩：「羽衣忽飄飄，玉鸞俄錚錚。」宋．歐陽修．秋聲賦：「鏦鏦錚錚，金鐵皆鳴。」形容人品卓越出眾。清．侯方域．李姬傳：「妾少從假母識陽羨君，其人有高義。聞吳君尤錚錚。」見「錚錚佼佼」條。,NA,2061
huang2~huang2,huáng~huáng,鍠鍠,鍠鍠,金,RED,hwang hwang,NA~NA,NA,onom. Tintinnabulation of bells,狀聲詞。形容鐘鼓聲。後漢書．卷六十上．馬融傳：「鍠鍠鎗鎗，奏於農郊大路之衢。」,NA,514
qiang1~qiang1,qiāng~qiāng,鎗鎗,鎗鎗,金,RED,tshjang-tshjang,NA~NA,"蹌蹌,蹡蹡,鎗鎗","onom. of harmonious sound of bells or other musical instrucments; move with assured ease; in orderly array, proper sequence",NA,NA,1261
zu2~zu2,zú~zú,鏃鏃,镞镞,金,RED,tsuwk-tsuwk,*[ts]ˤok~*[ts]ˤok,NA,"(med.) avant-garde, out in front, best and brightest",NA,NA,2107
keng1~keng1,kēng~kēng,鏗鏗,铿铿,金,RED,kheaeng khaeng,NA~NA,NA,onom. Clanging bell; onom. Tinkling pendants; onom. Plucked zither string,狀聲詞。形容金屬或瓦石的響聲。禮記．樂記：「鍾聲鏗鏗以立，號號以立，橫橫以立，武君子聽鍾聲則思武臣。」形容言語明確響亮。後漢書．卷七十九．儒林傳上．楊政傳：「少好學，從代郡，范升受梁丘易，善說經書。京師為之語曰：『說經鏗鏗楊子行。』」,NA,730
qiang1~qiang1,qiāng~qiāng,鏘鏘,锵锵,金,RED,tshjang-tshjang,NA~NA,NA,"onom. of jingle-jangle of carriage-bells, the tink-clink of pendants; towering aloft, high in the sky; with ease and grace",狀聲詞：(1)​ 形容玉石撞擊聲。三國演義．第四十四回：「衣冠濟濟，劍佩鏘鏘，分班侍立。」(2)​ 形容鈴聲。詩經．大雅．韓奕：「百兩彭彭，八鸞鏘鏘。」漢．秦嘉．贈婦詩三首之三：「肅肅僕夫征，鏘鏘揚和鈴。」(3)​ 形容鳳凰和鳴聲。左傳．莊公二十二年：「鳳凰于飛，和鳴鏘鏘。」高聳巍峨的樣子。後漢書．卷五十九．張衡傳：「命琅掌策駟兮，踰高閣之鏘鏘。」行走的樣子。文選．左思．吳都賦：「出車檻檻，被練鏘鏘。」或作「蹡蹡」。,NA,1262
dang1~dang1,dāng~dāng,鐺鐺,铛铛,金,RED,tang tang,NA~NA,NA,onom. Of metal being struck; onom. Pluck of clepysdra,狀聲詞：(1)​ 形容更漏聲。南朝陳．徐陵．與齊尚書僕射楊遵彥書：「至于鐺鐺曉漏，的的宵烽，隔漵浦而相聞，臨高臺而可望。」(2)​ 形容金屬撞擊所發出的聲音。如：「鐘聲鐺鐺的響了。」亦作「璫璫」。樂器名。以一面直徑十五釐米的小鑼，用繩子綁在曲折形的木架上，左手執木架的下端，右手以木槌敲擊。用於河北地區的吹歌會和佛教音樂中。,NA,269
biao1~biao1,biāo~biāo,鑣鑣,镳镳,金,RED,pjew pjew,NA~NA,NA,"gorgeously trimmed, lavishly decked (esp. of a horse)",盛多的樣子。廣雅．釋訓：「鑣鑣，盛也。」詩經．衛風．碩人：「朱幩鑣鑣，翟茀以朝。」,NA,77
zuo4~zuo4,zuò~zuò,鑿鑿,凿凿,金,RED,tsak-tsak,*[dz]ˤawk~*[dz]ˤawk,NA,bright and vivid,鮮明的樣子。詩經．唐風．揚之水：「揚之水，白石鑿鑿。」唐．白居易．香鑪峰下新置草堂即事詠懷題於石上詩：「白石何鑿鑿，清流亦潺潺。」確實可信。宋．蘇軾．鳧繹先生詩集敘：「言必中當世之過，鑿鑿乎如五穀必可以療飢。」清．孔尚任．桃花扇．第十二齣：「小弟之言鑿鑿有據，聞得前日還託柳麻子去下私書的。」近確切,NA,2112
xian2~xian2,xián~xián,閒閒,閒閒,門,RED,hean-hean,NA~NA,NA,quite unconcerned,有所分別。莊子．齊物論：「大知閑閑，小知閒閒。」或作「間間」。從容優閒的樣子。詩經．魏風．十畝之間：「十畝之間兮，桑者閑閑兮。」唐．王維．歸嵩山作詩：「清川帶長薄，車馬去閑閑。」廣闊博大的樣子。莊子．齊物論：「大知閑閑，小知閒閒。」成玄英．疏：「閑閑，寬裕也。」動搖的樣子。漢書．卷一○○．敘傳下：「戎車七征，衝輣閑閑。」小孩學說話時的聲音。金瓶梅．第三十五回：「平安兒從新做了小孩兒，纔學閑閑。他又會頑，成日只踢毬兒耍子。」,I don't know if this really is an ideophone; radical support?,1651
min3~min3,mǐn~mǐn,閔閔,闵闵,門,RED,minX minX,*mrə[n]ʔ~*mrə[n]ʔ,NA,"mild and merciful, calm; concerned and caring; muddled; anxious",祈求關愛、憂慮的樣子。左傳．昭公三十二年：「閔閔焉如農夫之望歲，懼以待時。」宋．蘇軾．稼說送張琥：「其平居所以自養，而不敢輕用以待其成者，閔閔焉如嬰兒之望長也。」,NA,1037
ge2~ge2,gé~gé,閤閤,閤閤,門,RED,kak kak,*[k]ˤ[o]p~*[k]ˤ[o]p,NA,onom. Of frog's croaking,NA,NA,407
lang2~lang2,láng~láng,閬閬,阆阆,門,RED,lang lang,NA~NA,NA,"gaping, hollow, yawning open",高大、空虛的樣子。漢書．卷八十七．揚雄傳上：「閌閬閬其寥廓兮，似紫宮之崢嶸。」明大的樣子。後漢書．卷五十九．張衡傳：「出紫宮之肅肅兮，集大微之閬閬。」,NA,789
tian2~tian2,tián~tián,闐闐,阗阗,門,RED,den-den,NA~NA,NA,"dunn-dunn, reverberant resonance, onom. of rolling thunder, of the rumbling of carriages, of the sound of drums",本形容車馬隊伍聲勢浩大。詩經．小雅．采芑：「伐鼓淵淵，振旅闐闐。」文選．左思．蜀都賦：「車馬雷駭，轟轟闐闐。」亦可比喻為盛大的樣子。唐．薛逢．上白相公啟：「飛龍在天，雲雨闐闐。」,radical support?,1493
guan1~guan1,guān~guān,關關,关关,門,RED,kwaen-kwaen,*[k]ˤro[n]~*[k]ˤro[n],NA,onom. Osprey's cry,狀聲詞。形容鳥鳴的聲音。詩經．周南．關雎：「關關雎鳩，在河之洲。」,NA,425
zhen4~zhen4,zhèn~zhèn,陣陣,阵阵,阜,RED,drinH-drinH,*lri[n]-s~*lri[n]-s,NA,"(med.) fitfully continuing, sporadic, intermittent",時有時無，斷續不止。唐．劉禹錫．淮陰行五首之三：「船頭大銅環，摩挲光陣陣。」宋．林逋．梅花詩：「小園煙景正淒迷，陣陣寒香壓麝臍。」,NA,2052
tao2~tao2,táo~táo,陶陶,陶陶,阜,RED,yew-yew,NA~NA,NA,"well-pleased and elated, satisfied and delighted; endlessly extended, stretching on and on; fleetly galloping, hurriedly hasting",和樂的樣子。三國．魏．劉伶．酒德頌：「無思無慮，其樂陶陶。」漫長。楚辭．玉逸．九思．哀歲：「冬夜兮陶陶，雨雪兮冥冥。」陽氣盛。史記．卷八十四．屈原賈生傳：「陶陶孟夏兮，草木莽莽。」,yao2 usually reads as tao2; radical support?,1476
reng2~reng2,réng~réng,陾陾,陾陾,阜,RED,nying-nying,NA~NA,NA,"more and more, much and many",眾多。詩經．大雅．綿：「捄之陾陾，度之薨薨。」,radical support?,1339
yong1~yong1,yōng~yōng,雝雝,雝雝,NA,RED,'jowng-'jowng,NA~NA,NA,"melodious, harmonious, sweet-sounding; pleasantly agreeable",和諧的樣子。詩經．大雅．思齊：「雝雝在宮，肅肅在朝。」近雍熙亦作「雍雍」。,radical support?,1945
li2~li2,lí~lí,離離,离离,隹,RED,lje lje,*[r]aj~*[r]aj,NA,"distant and dense; divorced and disjointed, split; hanging heavy (of grain)",分披繁盛的樣子。詩經．王風．黍離：「彼黍離離，彼稷之苗。」宋．陸游．病起詩：「斷香漠漠便支枕，芳草離離悔倚闌。」果實下垂的樣子。漢．張衡．西京賦：「神木靈草，朱實離離。」剝裂的樣子。楚辭．劉向．九歎．思古：「曾哀悽欷心離離兮，顧高丘泣如灑兮。」不親事的樣子。荀子．非十二子：「勞苦事業之中，則儢儢然，離離然。」茂盛的樣子。唐．溫庭筠．郭處士擊甌歌：「三十六宮花離離，軟風吹春星斗稀。」,NA,809
fen1~fen1,fēn~fēn,雰雰,雰雰,雨,RED,pjun pjun,NA~NA,NA,snow-frosted air; falling snow-shimmering,雨雪很盛的樣子。詩經．小雅．信南山：「上天同雲，雨雪雰雰。」漢．張衡．四愁詩四首之四：「我所思兮在鴈門，欲往從之雪雰雰。」霜凝結的樣子。楚辭．屈原．九章．悲回風：「漱凝霜之雰雰，依風穴以自息兮。」,also synonymous with 氛氳,368
huo4~huo4,huò~huò,霍霍,霍霍,雨,RED,xwaek xwaek,NA~NA,NA,"in a flash, in a flicker; onom. Sharpening a sword",狀聲詞。形容磨刀急速的聲音。南朝梁．無名氏．木蘭詩二首之一：「小弟聞姊來，磨刀霍霍向豬羊。」聊齋志異．卷一．賈兒：「塗已，無所作，遂把廚刀霍霍磨之。」閃亮。宋．劉子翬．諭俗詩十二首之八：「乞靈走群祀，晚電明霍霍。」,NA,552
sha4~sha4,shà~shà,霎霎,霎霎,雨,RED,sreap-sreap,NA~NA,NA,"onom. of drumming rain, prap-prap",NA,NA,1370
fei1~fei2,fēi~féi,霏霏,霏霏,雨,RED,phj+j ph+j,NA~NA,NA,"heavy fall of snow or rain; pelting (snow, rain); blurry (clouds, misty)",雨雪煙雲盛密的樣子。宋．范仲淹．岳陽樓記：「若夫霪雨霏霏，連月不開。」三國演義．第三十七回：「忽然朔風凜凜，瑞雪霏霏。」騰起飛揚的樣子。楚辭．屈原．九章．惜誦：「霰雪紛其無垠兮，雲霏霏而承宇。」草木茂盛的樣子。唐．杜甫．宣政殿退朝晚出左掖詩：「宮草霏霏承委佩，鑪煙細細駐遊絲。」淚流滿面的樣子。南朝梁．范雲．贈張徐州謖詩：「懷情徒草草，淚下空霏霏。」,NA,354
ai3~ai3,ǎi~ǎi,靄靄,霭霭,雲,RED,'ajH-'ajH,NA~NA,NA,"thin mists, thin mass of wind-driven clouds, cloud-whisps; rack, wrack",聚集的樣子。晉．陶淵明．停雲詩：「靄靄停雲，濛濛時雨。」西遊記．第三十四回：「博山爐裡，靄靄香煙。」雪很盛的樣子。南朝宋．謝惠連．雪賦：「靄靄浮浮，瀌瀌弈弈。」,NA,6
qing1~ying2,qīng~yíng,青熒,青荧,NA,RED,tsheng-hweng,*[s.r̥]ˤeŋ~*[N]-qʷˤeŋ,NA,"palely gleaming, shimmering, twinkling",NA,NA,1290
yang1~yang1,yāng~yāng,鞅鞅,鞅鞅,革,RED,'jangX-'jangX,NA~NA,NA,"dissatisfied, displeased; feel wronged, inequitable",不滿意、不快樂的樣子。漢書．卷一．高帝紀：「諸將故與帝為編戶民，北面為臣，心常鞅鞅。」亦作「怏怏」。,NA,1788
wei3~wei3,wěi~wěi,韡韡,韡韡,華,RED,hjw+jX-hjw+jX,*[ɢ]ʷə[j]ʔ~*[ɢ]ʷə[j]ʔ,NA,"vividly dazzling, gorgeously glistening",光明盛大的樣子。詩經．小雅．常棣：「常棣之華，鄂不韡韡。」,NA,1575
xu1~xu1,xū~xū,頊頊,顼顼,玉,RED,xjowk-xjowk,*qʰ(r)ok~*qʰ(r)ok,NA,disappointed and dejected; peeved and nettled,茫然自失的樣子。莊子．天地：「子貢卑陬失色，頊頊然不自得，行三十里而後愈。」,radical support?,1727
yong2~yong2,yóng~yóng,顒顒,顒顒,頁,RED,ngjowng-ngjowng,NA~NA,"喁喁, 顒顒, 顒然","eagerly expectant; answerin agreement, be in tune with, jibe with; chime in compliantly; accompany",溫和的樣子。詩經．大雅．卷阿：「顒顒卬卬，如圭如璋，令聞令望。」仰慕的樣子。淮南子．俶真：「是故聖人呼吸陰陽之氣，而群生莫不顒顒然。」波高的樣子。文選．枚乘．七發：「顒顒卬卬，椐椐彊彊。」,radical support?,1949
dian1~dian1,diān~diān,顛顛,颠颠,頁,RED,ten ten,*tˤi[n]~*tˤi[n],NA,focused concentration; steady attention,專一的樣子。莊子．馬蹄：「故至德之世，其行填填，其視顛顛。」憂思的樣子。禮記．玉藻：「喪容纍纍，色容顛顛。」瘋狂。北史．卷七．齊文宣紀：「問婦人曰：『天子何如？』答曰：『顛顛痴痴，何成天子。』帝乃殺之。」,NA,290
sa4~sa4,sà~sà,颯颯,飒飒,𠘨,RED,sop-sop,NA~NA,NA,"onom. of the wind, whooshing and rushing, gusting and blustering; or of falling rain, plashing and splotching, lap-lap; descriptive of speed, in no time, swift and sudden",形容風聲。楚辭．屈原．九歌．山鬼：「風颯颯兮木蕭蕭，思公子兮徒離憂。」儒林外史．第四十二回：「只見一陣陰風，颯颯的響，滾了進來。」形容水聲。唐．李頎．聽董大彈胡笳聲兼寄語弄房給事詩：「迸泉颯颯飛木末，野鹿呦呦走堂下。」唐．杜甫．乾元中寓居同谷縣作詩七首之四：「四山多風溪水急，寒雨颯颯枯樹濕。」,NA,1357
lie4~lie4,liè~liè,颲颲,颲颲,𠘨,RED,ljet ljet,NA~NA,NA,fierce wind,NA,NA,857
yao2~yang2,yáo~yáng,颻颺,颻颺,𠘨,RED,yew-yang,NA~*laŋ,NA,"borne on the breeze, adrift on the wind, afloat and aflutter, drifitng to and fro, lightly aloft",風吹搖盪的樣子。文選．左思．吳都賦：「與風颻颺，䬀瀏颼飀。」,NA,1813
sou1~sou1,sōu~sōu,颼颼,飕飕,𠘨,RED,srjuwH-srjuwH,NA~NA,NA,onom. of blowing of wind or rain: shooh-shooh,狀聲詞。形容風吹、雨打的聲音。唐．鄭谷．鷺鷥詩：「閑立春塘煙澹澹，靜眠寒葦雨颼颼。」儒林外史．第二十八回：「內中又有參天的大木，幾萬竿竹子，那風吹的到處颼颼的響。」寒冷的樣子。唐．杜牧．洛中送冀處士東游詩：「論今星璨璨，考古寒颼颼。」紅樓夢．第六十六回：「冷颼颼，明亮亮，如兩痕秋水一般。」,NA,1415
fan1~fan1,fān~fān,颿颿,颿颿,𠘨,RED,bjom bjom,NA~NA,帆帆,galloping as fast as the wind,走得很快的樣子。如：「她往這個方向颿颿而來。」,NA,341
liu2~liu2,liú~liú,飀飀,飀飀,𠘨,RED,ljuw ljuw,NA~NA,NA,onom. Gentle wind,NA,NA,913
liao2~liao2,liáo~liáo,飂飂,飂飂,𠘨,RED,lew lew,NA~NA,NA,"rust and gust, rush and roar (high wind); blank and empty",風高吹的樣子。淮南子．覽冥：「故至陰飂飂、至陽赫赫，兩者交接成和而萬物生焉。」三國．魏．阮籍．清思賦：「聲飂飂以洋洋，若登崑崙而臨西海。」,cf. 寥寥,848
piao1~piao1,piāo~piāo,飄飄,飘飘,𠘨,RED,phjew-phjew,NA~NA,NA,"wafted aloft, floating and fluttering, gracefully gliding, wind-whirled, tossed and tumbled, whirling and swirling; also (med.) of roads, twisting and turning, hard to travel",風吹的樣子。文選．陶淵明．歸去來辭：「舟搖搖以輕颺，風飄飄而吹衣。」輕舉飛揚。史記．卷一一七．司馬相如傳：「飄飄有淩雲之氣，似游天地之閒意。」飄泊不定。唐．杜甫．旅夜書懷詩：「飄飄何所似，天地一沙鷗。」,NA,1168
liao2~liao2,liáo~liáo,飉飉,飉飉,𠘨,RED,lew lew,NA~NA,NA,"light breeze, breezy",NA,NA,849
bo2~bo2,bó~bó,馞馞,馞馞,香,RED,bot bot,NA~NA,NA,bursting with scent,NA,NA,94
jiong1~jiong1,jiōng~jiōng,駉駉,駉駉,馬,RED,kweng kweng,NA~NA,NA,"flush and well-fed, sleek and strong (of horses)",馬肥壯的樣子。詩經．魯頌．駉：「駉駉牡馬，在坰之野。」,NA,657
pi1~pi1,pī~pī,駓駓,駓駓,馬,RED,phij-phij,NA~NA,NA,"speed posthaste, at a full gallop",NA,NA,1150
qin1~qin1,qīn~qīn,駸駸,駸駸,馬,RED,tshim-tshim,*[tsʰ][i]m~*[tsʰ][i]m,NA,"headlong gallop; effortless sweep, sweeping rush, hurry-scurr, lickety-split",馬跑得很快的樣子。詩經．小雅．四牡：「駕彼四駱，載驟駸駸。」文選．阮籍．詠懷詩十七首之十七：「皋蘭被徑路，青驪逝駸駸。」比喻時間過得很快。南朝梁．簡文帝．納涼詩：「斜日晚駸駸，池塘生半陰。」宋．蘇軾．臨江仙．自古相從休務日詞：「淒風寒雨是駸駸，問囚長損氣，見鶴忽驚心。」形容事物日趨進步強大。宋．蘇洵．審勢：「秦自孝公，其勢已駸駸焉，日趨於強大。」老殘遊記．第十一回：「然後由歐洲新文明進而復我三皇五帝舊文明，駸駸進於大同之世矣。」,NA,1281
fei1~fei1,fēi~fēi,騑騑,騑騑,馬,RED,missing,NA~NA,NA,striding steadily onward (horses),馬不停蹄，向前急行的樣子。詩經．小雅．四牡：「四牡騑騑，周道倭遲。」漢．蔡琰．胡笳十八拍：「漢使迎我兮四牡騑騑，號失聲兮誰得知？」,NA,351
kui2~kui2,kuí~kuí,騤騤,騤騤,馬,RED,gwij gwij,NA~NA,NA,stately and strong (of horses),馬強壯的樣子。詩經．小雅．采薇：「駕彼四牡，四牡騤騤。」,NA,759
sao1~sao1,sāo~sāo,騷搔,骚搔,NA,RED,saw-saw,*[s]ˤu~*s-[ts]ˤu,NA,"of fast-running wate, hissing and surging; of heavy wind, gusting and galing, rush and bluster",NA,radical support?,1363
yu4~yu4,yù~yù,鬱鬱,鬱鬱,NA,RED,'jut-'jut,*qut~*qut,"鬱鬱, 蔚蔚, 蔚結, 鬱悒","feeling stifled and smothered, grim and glum, dour and depressed, with thoughts bound and knotted",文采美盛的樣子。論語．八佾：「周監於二代，郁郁乎文哉，吾從周。」香氣濃烈的樣子。文選．司馬相如．上林賦：「郁郁菲菲，眾香發越。」悶悶不樂。史記．卷九十二．淮陰侯傳：「吾亦欲東耳，安能鬱鬱久居此乎？」近邑邑茂盛的樣子。文選．古詩十九首．青青河畔草：「青青河畔草，鬱鬱園中柳。」芳香。文選．劉孝標．廣絕交論：「且心同琴瑟，言鬱郁於蘭茝。」李善．注：「鬱郁，香也。」,NA,1993
yi4~yi4,yì~yì,鶂鶂,鶂鶂,鳥,RED,ngek-ngek,NA~NA,NA,"cackle-cackle, of goose",鵝鳴聲。孟子．滕文公下：「惡用是鶂鶂者為哉。」,NA,1888
yu3~yu3,yǔ~yǔ,麌麌,麌麌,鹿,RED,ngjuH-ngjuH,NA~NA,NA,herd and huddle together,鹿群聚集的樣子。詩經．小雅．吉日：「獸之所同，麀鹿麌麌。」或作「噳噳」。,is this an ideophone?,1987
mo4~mo4,mò~mò,默默,默默,黑,RED,mot mot,NA~NA,NA,"1. soundless, silent; hushed, mute; wordless; tacit, muffled.
a. still and soundless, tacit and tranquil; silently, desolate; wordlessly eloquent
2. darkened, dimmed; blackened",沉靜不說話。楚辭．王逸．卜居：「讒人高張，賢士無名，吁嗟默默兮，誰知吾之廉貞？」明．歸有光．項脊軒志：「吾兒！久不見若影，何竟日默默在此，大類女郎也？」近悄悄、沉默、沉靜反喋喋不得意的樣子。漢書．卷四十八．賈誼傳：「吁嗟默默，生之無故兮！」暗地裡。紅樓夢．第五十六回：「（寶玉）​心中悶悶，回至房中榻上，默默盤算，不覺就忽忽的睡去。」,NA,1052
you3~you3,yǒu~yǒu,黝黝,黝黝,黑,RED,'jiwX-'jiwX,NA~NA,NA,"steel-gray; glossy black, vitreous, livid, swarthy",陰暗的樣子。文選．左思．魏都賦：「黝黝桑柘，油油麻紵。」南朝梁．任昉．落日泛舟東溪詩：「黝黝桑柘繁，芃芃麻麥盛。」,NA,1973
tan3~tan3,tǎn~tǎn,黮黮,黮黮,黑,RED,thomX-thomX,NA~NA,"黯黮, 黮暗, 黮䨴, 黮黮","grim and gloomy, sullen and somber, bleak and black",NA,NA,1454
yin2~yin2,yín~yín,齗齗,齗齗,齒,RED,ngj+n-ngj+n,NA~NA,NA,"bare one's teeth, show one's gums; snarl at",爭辯的樣子。漢書．卷三十六．楚元王劉交傳：「朝臣齗齗不可光祿勳，何〔邪〕？」唐．柳宗元．愚溪詩序：「古有愚公谷，今予家是溪，而名莫能定，土之居者猶齗齗然，不可以不更也。」,NA,1924
yin2~yin2,yín~yín,齦齦,龈龈,齒,RED,ngj+n-ngj+n,NA~NA,NA,"argue, jaw at; contend; banter andbadinage, raillery",NA,NA,1925
yao1~mo2,yāo~mó,么麼,么麽,NA,RR,'ew-mwa,NA~NA,NA,scant and slight,NA,NA,1806
yi1~yi4,yī~yì,伊邑,伊邑,NA,RR,'jij-'jip,*ʔij~*q(r)[ə]p,NA,"fuddled and fretful, grieved, despondent",NA,NA,1850
ling2~ping1,líng~pīng,伶俜,伶俜,人,RR,leng-pheng,NA~NA,俜伶,"all on one's own, single solitary, one and only; also, stagger unsteadily",飄零孤單的樣子。樂府詩集．卷七十三．雜曲歌辭十三．古辭．焦仲卿妻：「晝夜勤作息，伶俜縈苦辛。」唐．杜甫．新安吏詩：「肥男有母送，瘦男獨伶俜。」,NA,901
chi4~yi4,chì~yì,佁儗,佁儗,人,RR,tsyhojH-ngojH,NA~NA,NA,"stuck fast, inert and immobile, at a standstill; (med.) easy and relaxed, slow and measured",NA,chi4 usually pronounced as yi3,191
yi4~yu4,yì~yù,佚豫,佚豫,NA,RR,yit-yoH,NA~*laʔ-s,NA,"lax and careless, nonchalant; speeding swiftly",NA,NA,1898
zhu1~ru2,zhū~rú,侏儒,侏儒,人,RR,tsyu-nyu,*to~NA,NA,"runty-stunted, diminutively dwarfish; (med.) short beams, stubby rafters",身材過度矮小的人。反巨人見「侏儒症」條。古代表演雜伎或以滑稽動作引人笑樂的藝人。荀子．王霸：「俳優侏儒婦女之請謁以悖之。」梁上短柱。禮記．明堂位．鄭玄．注：「藻梲，畫侏儒柱，為藻文也。」唐．韓愈．進學解：「夫大木為杗，細木為桷，欂櫨侏儒，椳闑扂楔，各得其宜，施以成室者，匠氏之工也。」,NA,2078
